id,authors,category,date,header,medium,format,genre,mediumType,price,section,text
68912787,['Juan Arvizu'],PRENSA,2018-01-29T03:02:59Z,"Vitral Político // La cucaracha, en campaña",Universal Gráfico,IMPRESO,Columna Política,Diario,18262.9,Al Día,"JUAN ARVIZU ARRIOJA EL SECRETARIO de Turismo, Enrique de la Madrid Cordero, resucitó el debate de la marihuana y lo dejó a las puertas de los cuarteles de campaña que tienen sus anexos en las cámaras de Diputados y Senadores, donde ya era expediente archivado. La reforma de abril pasado, incluyó normas para el uso medicinal de la yerba. Al carro le faltan tres ruedas. De la Madrid Cordero ha pedido la despenalización y eso tiene dividido al PRI. El gobierno de Enrique Peña Nieto no quiere la legalización del consumo, producción, distribución. No ve a la marihuana como materia prima de una industria. Lo cierto es que el estupefaciente es un engrane de la máquina de violencia criminal. La marihuana huele raro en la coalición Por México al Frente, en la que están el agua y el aceite, el PAN y PRD, unos en contra, otros a favor, incluso en el mismo partido. En Juntos Haremos Historia nadie se mueve, aunque hay voces contra la prohibición. El tema en el Congreso, como La Cucaracha, no puede caminar, porque le faltan consensos. Así, don Enrique de la Madrid metió al 2018 en un churro EMPLOMADO.César Camacho Quiroz y Jorge Carlos Ramírez Marín solicitaron ser candidatos a senadores e irán a hacer campaña para ganar el escaño priista. El dúo tiene pasta de liderazgo de alta escuela legislativa SOLDADURA. El presidente de la Federación de Sindicatos de Trabajadores al Servicio del Estado ( FSTSE ) y senador del PRI, Joel Ayala Almeida, informa que no buscará una diputación federal en estas elecciones. Reporta que llevará adelante las negociaciones de incremento salarial a favor de 2 millones de agremiados de las 89 organizaciones de esa central, ante la Secretaría de Hacienda. El objetivo de Ayala es alcanzar un acuerdo de mejora de dos puntos arriba de la inflación. Dijo que como priista brinda su apoyo al precandidato presidencial José Antonio Meade VENTANAL Emilio Gamboa invitó a siete secretarios de Estado y otros funcionarios a la última reunión plenaria de su grupo senatorial, que impulsará los tópicos de Anticorrupción. El asunto es el gran tema, también para la mancuerna del PAN y PRD, así como para el PT-Morena. Hoy, Andrés Manuel López Obrador anuncia a sus fiscales HERRAJE. El delegado en Cuajimalpa, Miguel Ángel Salazar Martínez, quien lleva la camiseta PRI-PVEM, está echado para adelante en su afán de ganar La candidatura por el Distrito Electoral 20 a la Asamblea Legislativa de la Ciudad de México. En su círculo cercano comentan que ha trabajado por igual para los vecinos de las colonias populares, como para atender las necesidades de las zonas de Santa Fe, Bosques de las Lomas, y otras más VIDRIOS SUCIOS En su último Informe, cuando tenía desplantes de aspirante presidencial, Miguel Ángel Mancera ofreció que habría basificación para 10 mil trabajadores de honorarios. Le recuerdan que no ha cumplido. Lo que ofreció el jefe de Gobierno fue justicia para quienes laboran en un gobierno de izquierda sin respeto a sus derechos constitucionales LUZ. Todo listo en Puebla para la gira de López Obrador del viernes 2 de febrero al siguiente martes 6, en la que el senador Miguel Barbosa Huerta será su anfitrión. En la tierra de Beatriz Gutiérrez Muller, esposa deltabasqueño, la ruta incluye 14 ciudades. VIDRIOS ROTOS El INE ha quedado 17 días pasmado, sin mostrar que es autoridad en el caso de la falsificación de credenciales de elector que denunció Pedro Ferriz de Con. La demora daña la confiabilidad en esa popular identificación MIRADOR. Jesús Reyes Heroles: Para qué adivinar lo que se tiene que saber El gobierno de Enrique Peña Nieto no quiere la legalización del consumo, producción, distribución. No ve a la marihuana como materia prima de una industria. Lo cierto es que el estupefaciente es un engrane de la máquina de violencia criminal."
68897343,['Gibrán Casas'],PRENSA,2018-01-28T03:06:20Z,Hallan sin vida a un hombre y una mujer en Ticoman de GAM,Universal Gráfico,IMPRESO,Nota de Portada,Diario,33526.3,Portada,"NO FUERON IDENTIFICADOS LA ROJA Vecinos localizaron los cuerpos en la calle Otoño, de la colonia Candelaria Ticomán, en GAM Gibrán Casas LOS CUERPOS de un hombre y una mujer, que aparentemente asesinaron a golpes, fueron encontrados la mañana de I ayer en calles de la colonia Candelaria Ticomán, en la Gustavo A. Madero. Vecinos de la zona encontraron a la pareja tirada en la calle Otoño, entre Veranoy Cacamatzin, alrededor de las 6:00 de la 1 mañanadeayer; ambos JB tenían los rostros en- jlj sangrentados. Poco des- IsB pués llegaron policías del sector Ticomán y al ver que ^ ninguno de los dos reaccionaba llamaron a los servicios de emergencia. Luego de revisarlos, paramédicos de la Cruz Roja diagnosticaron que los dos habían muerto por golpes. NO ESCUCHARON NADA. De acuerdo con habitantes, no se escuchó ningún ruido raro durante la ma drugada, por lo que autoridades la vestigan si fueron asesinados en otn lugar. Ambos cadáveres fueron llevados en una ambulancia fúnebre al anfiteatro de la Coordinación Territorial GAM-2, donde el agente del MP inició la carpeta de investigación por homicidio doloso por otras causas. Vecinos localizaron los cuerpos en la calle Otoño, de la colonia Candelaria Ticomán, en GAM Gibrán Casas LOS CUERPOS de un hombre y una mujer, que aparentemente asesinaron a golpes, fueron encontrados la mañana de I ayer en calles de la colonia Candelaria Ticomán, en la Gustavo A. Madero. Vecinos de la zona encontraron a la pareja tirada en la calle Otoño, entre Veranoy Cacamatzin, alrededor de las 6:00 de la 1 mañanadeayer; ambos JB tenían los rostros en- jlj sangrentados. Poco des- IsB pués llegaron policías del sector Ticomán y al ver que ^ ninguno de los dos reaccionaba llamaron a los servicios de emergencia. Luego de revisarlos, paramédicos de la Cruz Roja diagnosticaron que los dos habían muerto por golpes. NO ESCUCHARON NADA. De acuerdo con habitantes, no se escuchó ningún ruido raro durante la ma drugada, por lo que autoridades la vestigan si fueron asesinados en otn lugar. Ambos cadáveres fueron llevados en una ambulancia fúnebre al anfiteatro de la Coordinación Territorial GAM-2, donde el agente del MP inició la carpeta de investigación por homicidio doloso por otras causas. Vecinos localizaron los cuerpos en la calle Otoño, de la colonia Candelaria Ticomán, en GAM Gibrán Casas LOS CUERPOS de un hombre y una mujer, que aparentemente asesinaron a golpes, fueron encontrados la mañana de I ayer en calles de la colonia Candelaria Ticomán, en la Gustavo A. Madero. Vecinos de la zona encontraron a la pareja tirada en la calle Otoño, entre Veranoy Cacamatzin, alrededor de las 6:00 de la 1 mañanadeayer; ambos JB tenían los rostros en- jlj sangrentados. Poco des- IsB pués llegaron policías del sector Ticomán y al ver que ^ ninguno de los dos reaccionaba llamaron a los servicios de emergencia. Luego de revisarlos, paramédicos de la Cruz Roja diagnosticaron que los dos habían muerto por golpes. NO ESCUCHARON NADA. De acuerdo con habitantes, no se escuchó ningún ruido raro durante la ma drugada, por lo que autoridades la vestigan si fueron asesinados en otn lugar. Ambos cadáveres fueron llevados en una ambulancia fúnebre al anfiteatro de la Coordinación Territorial GAM-2, donde el agente del MP inició la carpeta de investigación por homicidio doloso por otras causas. AGENTES presumen que fueron asesinados en otro lugar. AGENTES presumen que fueron asesinados en otro lugar."
68792620,['Diana Villavicencio'],PRENSA,2018-01-23T06:36:11Z,Comerciantes en Humboldt piden apoyos,Universal Gráfico,IMPRESO,Nota Informativa,Diario,6618.21,Al Día,"Diana Villavicencio LA REPARACIÓN del socavón en la calle de Humboldt y Colón registrado en agosto ha sido un trabajo complicado, reconoció el jefe de Gobierno, Miguel Ángel Mancera. Luego de que hace unos días concluyeran los trabajos de reparación y que por la zona fuera reabiertoelpasopeatonaly vehicular este lunes, Mancera dijo que se seguirá trabajando en ese sitio. Por su parte, dueños de negocios afectados denunciaron que no han recibido ningún apoyo para indemnización. Mónica Martínez, dueña de la Tortería Armando, acusó que ni siquiera les han otorgado el seguro de desempleo ya que el depósito de diciembre no cayó. Los afectados exigieron ayuda para poder recuperarse de las pérdidas económicasy morales que ocasionaron las obras. Nadie nosescucha, se reportó la zona dañada varias veces y todo esto se podría haber evitado, señaló Martínez. Al respecto, Mancera dijo ayer que se daría atención inmediata: Pediré una actualización para finalmente poder tener mayor contacto, pero no se va a dejar de atender, sobre todo los negocios."
68865555,['Ricardo Ham'],PRENSA,2018-01-26T07:49:08Z,Trata de personas en México,Universal Gráfico,IMPRESO,Nota Informativa,Diario,40448.1,La Roja,"Ricardo Ham HAY OJOS que han visto el peor rostro del ser humano y sin embargo reflejan esperanza, así es la mirada de Rosy Orozco, incansable luchadora contra la trata de personas. Sus 27 años como activista la ha llevado a convertirse en presidenta de Unidos Contra la Trata que ha conseguido exponer ante la opinión pública el descarnado rostro de la millonaria industria de la trata de personas. A su mesa llegan cientos de historias, los comunes denominadores en ellas son: el engaño, pobreza, ignorancia, amor e impunidad. Para muestra, en 2009 una niña de sólo 12 años, originaria de Juchitán, Oaxaca, llegó a la ciudad en busca de empleo en . alguna de las casas adineradas de Polanco, luego fue trasladada a el Estado de México, para ; ser exactos a Hacienda las Palmas, en la zona residencial de ( nterlomas donde viviría una pesadilla que incluyó encierro, hambre, así como maltratos fíps y sexuales. i Jiménez López y ¡Tatiana y Jorge, fueisables del sufrila niña juchiteca, la [ a laborar jomadas ¡que iniciaban a las 5:00 de la mañana, no tenía un salario y permanecía encerrada en el departamento de lujo ubicado en Hacienda del Ciervo 23, Torre B en Villas de La Palmas. Sus captoras sólo la alimentaban con arroz y frijoles, la golpeaban constantemente, dormía en la frialdad de una tina de baño, además de ser abusada sexualmente por el hijo de la patrona. Alejada de los reflectores que le daba su puesto político, Rosy continúa con la batalla contra los traficantes y explotadores de personas, menciona que las barreras que tuvo que superar fueran la indiferencia, más que de la clase política, de la misma sociedad mexicana que no prestaba atención alterna de la explotación de personas, sin embargo, menciona que los medios de comunicación han sido sus aliados para informar, sensibilizar a la ciudadanía y obligar a las autoridades que cumplan su trabajo. Pero el camino aún es largo, la falta de refugios indicados para las personas arrancadas de las garras de los tratantes, es una piedra que sigue estorbando en el camino, según Rosy sola la Ciudad de México, Puebla, Baja California Norte y el Estado de México cuentan con instalaciones adecuadas para las víctimas, donde encuentras ayuda psicológica y el trato humano necesario para que la víctima no caiga en depresión y busque puertas falsas como el de las adicciones. Otras entidades como Chiapas, coloca a las mujeres sobrevivientes de trata en los mismos refugios que las féminas que huyen del maltrato intrafamiliar, exponiéndolas así al señalamiento y estigmatización por parte de quienes cohabitan los resguardos. Resulta muy penoso para un país como el nuestro que muchas de sus entidades federativas ni siquiera reconozcan el problema de la trata de personas dentro de sus legislaciones, son 6 entidades las que carecen de una ley contra la trata: Morelos, Campeche, Aguas Calientes, Baja California Sur, Chihuahua y Zacatecas. Solamente 14 gobiernos estatales han sido capaces de ejecutar sentencias penales contra tratantes, menos de la mitad del total, los restantes 18 estados no tienen en sus reclusoriosalgún condenado por tráfico de personas. Unidos contra la Trata reconoce en el gobierno de la CDMX, la actitud, sensibilidad y experiencia necesaria para combatir la trata de personas, Orozco menciona que desde el operativo, saben perfectamente cómo actuar para no caer en abusos contra las víctimas"
68917584,['Redacción'],PRENSA,2018-01-29T07:00:10Z,Atropellan a su amiguito y se quedan a cuidarlo,Universal Gráfico,IMPRESO,Nota Informativa,Diario,16471.2,Mundo,"Cinco perros estaban cruzando una calle en la ciudad china de Lanzhou, pero uno de ellos no logró llegar al otro lado. Fue atropellado por un auto. Los perros enseguida vol vieron por su amigo e intentaron reanimarlo y ayudarlo a alejarse del peligroso tráfico, rechazando la triste realidad de que el animal ya no iba a levantarse. FOTOGRAFÍAS: YOUTUBE H TIROTEO DEJA CINCO MUERTO Cinco personas murieron ayer en la madrugada durante un tiroteo en Pensilvania, Estados Unidos. Una persona armada abrió fuego sobre un grupo que se encontraba en un taller de lavado de autos. Cinco perros estaban cruzando una calle en la ciudad china de Lanzhou, pero uno de ellos no logró llegar al otro lado. Fue atropellado por un auto. Los perros enseguida vol vieron por su amigo e intentaron reanimarlo y ayudarlo a alejarse del peligroso tráfico, rechazando la triste realidad de que el animal ya no iba a levantarse."
68498502,['Ariadna Montoya'],PRENSA,2018-01-07T08:42:23Z,Por la supremacía,Universal Gráfico,IMPRESO,Nota Informativa,Diario,39345.0,Deportes,"LA MISIÓN del América en el Clausura 2018 es volver a poner un trofeo en sus vitrinas. En 2017 el equipo no ganó títulos y su reto es bordar la estrella 13 en su playera para ser de nuevo en el equipo con más campeonatos en México. Para recuperar la supremacía, los emplumados se reforzaron su ataque con el francés Jérémy Ménez y el colombiano Andrés Ibargüen. También con tres elementos de la Liga MX: Henry Martin, Joe Corona y Víctor Aguilera, todos procedentes de Xolos. Además, los de Coapa aprovecharán la gira que tendrá el PSV por Estados Unidos para negociar la contratación del holandés Luuk de Jong, jugador que ha manifestado que quiere jugar con las Águilas. La tropa de Coapa decidió darle las gracias para este torneo a los defensas Miguel Samudio y Pablo Aguilar, quienes fueron adquiridos por Querétaro y Tijuana, de manera respectiva. ASUNTOS PENDIENTES. Uno de los problemas que los azulcremas deben corregir de inmediato en el Clausura 2018 es la falta de contundencia. Apenas suman dos goles en sus últimos ocho partidos de Liga y Liguilla, además de que en sus cuatro duelos de la pasada Fiesta Grande fueron incapaces de anotar. Otra materia pendiente es hacer valer su localía, pues de los nueve encuentros que disputaron en el Azteca en el Apertura 2017 sólo ganaron tres, empataron y perdieron el mismo número de cotejos. VOLAR EN CONCACAF. Para este semestre, América buscará trascender en el plano internacional al disputar la Liga de Campeones de Concacaf. En dicho torneo enfrentará en octavos de final al Saprissa de Costa Rica último equipo no mexicano en ganar la justa. La escuadra amarilla presume el récord de más títulos en la competencia de la zona, con siete, por encima de Cruz Azul ( 6 ) y Pachuca ( 5 Y desea obtener otro trofeo de Concachampions para poder disputar el Mundial de Clubes. LAS AGUILAS visitarán a los Pumas en la fecha tres, recibirán al Guadalajara en la jornda 10 y en la 13 serán anfitrionas del Cruz Azul en el torneo Clausura 2018. CAMBIOS ALTAS: Henry Martin, Joe Corona, Víctor Aguilera, Jérémy Ménez y Andrés Ibargüen. BAJAS: Miguel Samudio, Pablo Aguilar, Manuel Pérez. JORNADA 1 Querétaro América QUERETARO n ii 18:00 IMAGEN TV LIGA MX"
68886308,['Enrique Gutiérrez'],PRENSA,2018-01-27T07:55:40Z,¡Vuelve la XFL!,Universal Gráfico,IMPRESO,Nota Informativa,Diario,21091.2,Deportes,"Enrique Gutiérrez EL FUTBOL PROFESIONAL será redefinido cuando la renovada liga Xtreme Football League ( XFL ) comience a principios de 2020. La XFL ofrecerá una experiencia innovadora, centrada en los aficionados, que incluirá juegos más cortos y rápidos y un entorno familiar, complementado por opciones de visualización multiplataforma e interacción con los fans a tiempo real. Los planes para el lanzamiento de la XFL incluyen ocho equipos, listas activas de 40 hombres y un calendario de temporada regular de 10 semanas, con una postemporada que consiste en dos juegos semifinales de postemporada y un juego de campeonato. La nueva XFL es una oportunidad emocionante para reimaginar el deporte favorito de Estados Unidos, indicó Vince McMahon.directory presiden te de la World Wrestling Entertainment ( WWE ). A medida que avanzamos hacia la patada inicial, esperamos escuchar e implementar ideas innovadoras de jugadores, entrenadores, expertos médicos, ejecutivos de tecnología, medios de comunicación y lo más importante fanáticos del fútbol, añadió. McMahon está personalmente inmiscuido en la creación de esta aventura, por medio de Alpha Entertainment, una nueva plataforma privada. La XFL era una liga profesionalquetuvo una sola temporada en 2001, pero que ahora tiene la intención de convertirse en competencia de la NFL."
68817534,['Binoculares'],PRENSA,2018-01-24T06:27:06Z,Binoculares,Universal Gráfico,IMPRESO,Columna Política,Diario,8020.71,Voces,"SI se va Después de estar ausente del palacio municipal durante una semana por la resolución de la Suprema Corte de Justicia de la Nación ( SCJN que ordenó la destitución y consignación de los cabildos 2016-2018, así como del 2013-2015, por incumplimiento en la ejecución de una sentencia de amparo que data del 2013, el alcalde priísta Erwin Castelán se presentó ayer al inmueble local y dijo estar dispuesto a acatar la resolución de las autoridades judiciales. El edil, que deberá dejar el cargo una vez que reciba la notificación de la Corte, al igual que el síndico y regidores de la actual gestión local, acudió a su oficina para atender algunos asuntos. De risa Las propuestas emitidas por los precandidatos del PRI a los Gobiernos federal y local, José Antonio Meade y Mikel Arrióla, respectivamente, sobre la instalación de un millón de nuevas cámaras de vigilancia provocaron sarcasmo en el jefe de Gobierno, Miguel Ángel Mancera. Durante su conferencia mañanera, el mandatario local también bromeó y recordó una frase que le decía su abuelito: El prometer no empobrece, el dar es lo que aniquila. Hacen vaquita Ante el clima de violencia que enfrenta el destino turístico de Los Cabos, empresarios decidieron entrarle al quite y construyen el cuartel militar que entregarán a la Secretaría de Marina, y ante el abandono de las policías locales, se han puesto también como meta lograr un nuevo modelo policial para el municipio. El Consejo Coordinador Empresarial de Los Cabos invertirá 140 millones de pesos para el cuartel, construido en un terreno donado por un empresario. Avanza en la primera etapa, que son los dormitorios para 250 elementos que estarán de manera permanente en el municipio."
68897858,['Redacción'],PRENSA,2018-01-28T03:39:10Z,Jennifer sufre por amor,Universal Gráfico,IMPRESO,Nota de Portada,Diario,46758.2,Portada,JLO Y ALEX RODRIGUEZ JLO Y ALEX RODRIGUEZ JLO Y ALEX RODRIGUEZ
68594229,['Silvia Ojanguren'],PRENSA,2018-01-12T07:09:28Z,En Confianza Mal y de malas,Universal Gráfico,IMPRESO,Recorte de Columnas,Diario,4908.75,Vida,"La medicación sin la recomendación de un especialista es un problema de salud pública y puede tener repercusiones negativas en nuestro cuerpo. El medicamento que te receta un médico tiene un propósito, luchar contra una enfermedad, mantenerla inactiva, prevenirla o tratar sus síntomas. Pero para que sea efectivo debe tomarse de acuerdo a las indicaciones que prescriba el doctor. Ante los cambios de temperatura en esta temporada invernal, de acuerdo con el Instituto Nacional de Enfermedades Respiratorias ( INER las enfermedades respiratorias tendrán un incremento del 35%. Este factor provoca un aumento en la práctica de la automedicación, pues para muchos es muy fácil optar por el Dr. Google escribiendo los síntomas y buscando rápidamente una solución. El que un medicamento le funcione a alguien más, no significa que será igual contigo. S.O."
68545927,['Arturo Ortiz Mayén'],PRENSA,2018-01-10T02:56:34Z,Actor no mató a modelo,Universal Gráfico,IMPRESO,Nota de Portada,Diario,13986.7,Portada,"ENCARGADO DE LA INVESTIGACIÓN LLEVÓ C/fcSO DE LESVY Actor exige una disculpa pública Axel Arenas se siente indignado por haber sido señalado como el homicida de modelo Arturo Ortiz Mayén TRAS LA exoneración del actor Axel Arenas del feminicidio de la modelo argentina Karen Aitón, el procurador capitalino Edmundo Garrido designó al subprocurador Marco Enrique Reyes Peña como encargado de la investigación. Este funcionario encabezó, como fiscal de Homicidios, las pesquisas de la muerte de Les EN LOS PRÓXIMOS días anunciará las acciones legales a seguir. Axel Arenas se siente indignado por haber sido señalado como el homicida de modelo Arturo Ortiz Mayén TRAS LA exoneración del actor Axel Arenas del feminicidio de la modelo argentina Karen Aitón, el procurador capitalino Edmundo Garrido designó al subprocurador Marco Enrique Reyes Peña como encargado de la investigación. Este funcionario encabezó, como fiscal de Homicidios, las pesquisas de la muerte de Les vy Osorio Berlín en la UNAM, concluyendo que se trató de un suicidio, aunque posteriormente el Tribunal de Justicia ordenó que se reclasificara el delito como un feminicidio agravado. Ayer, el procurador capitalino rechazó que hayan fabricado un culpable en este caso. Dijo que las pruebas que presentaron ante un juez fueron suficientes para que girara la orden de aprehensión contra el actor. A decir de Garrido, este proceso es normal dentro del nuevo sistema de justicia penal y descartó errores en la investigación. Yo no diría que estamos hablando de errores, estamos hablando de un Sistema Acusatorio que tiene reglas distintas al tradicional. En este. sistema es el juez de Control quien decide si los elementos de prueba que se le acercan reunió con el procurador. Al son suficientes para seguir con término del encuentro en el el procedimiento y en este caso búnker, el actor se dijo indignaasí lo fue, por eso se otorgó la do por haber sido señalado orden de aprehensión, señaló, como responsable de un asesiPor la tarde, Axel Arenas se nato sin pruebas. de prueba que se le acercan reunió con el procurador. Al son suficientes para seguir con término del encuentro en el el procedimiento y en este caso búnker, el actor se dijo indignaasí lo fue, por eso se otorgó la do por haber sido señalado orden de aprehensión, señaló, como responsable de un asesiPor la tarde, Axel Arenas se nato sin pruebas. Así lo dijo Me encuentro muy tranquilo, muy agradecido con toda la gente que estuvo siempre a mi lado, con toda mi familia y amigos AXEL ARENAS Actor"
68509726,['Oscar Ramirez'],PRENSA,2018-01-08T08:00:18Z,Comio gallo,Universal Gráfico,IMPRESO,Nota de Portada,Diario,47671.1,Portada,"Gracias a| un riflazo de Martin, América ] vence a Los Gallos y acaba icón la sequía goleadora de lasÁquila: Óscar Ramírez Cario I ii UuiTd.no QUERÉTARO Con un golazo de Henry Martín, el América derrotó 1-0 a Gallos Blancos en el estadio Corregidora, en partido correspondiente a la fecha 1 del torneo Clausura 2018 de la Liga MX. Durante el calentamiento, los Gallos portaron una pla yera con el número 21, en homenaje al mediocampista Mai co Jiménez. Además, al minuto 21 los aficionados corearon el nombre del veterano y querido jugador, quien ya no entra en los planes del cuadro queretano. Luis Fernando Tena decidió mandar de titulares a dos de sus refuerzos fichados durante el pasado draft: Miguel Samudio por la lateral izquierda y Diego Novai etli en la defensa central. El gafete de capitán lo portó el arquero TiagoVolpi. Al inicio, Camilo Sanvezzo intentó controlar en el área y se topó con varias piernas rivales que impidieron su remate. El Lobo pidió penal pero el silbante Jorge Pérez Duran no lo concedió. Los queretanos eran mejores en la primera mitad. Lo más peligroso de las Águilas fue un remate de Paul Aguila! en fuera de lugar. Peroal44 Darwin Quintero asisitió a la llegada de Henry Martín y éste mandó guardar el esférico con un potente disparo para el 1-0. Para el complemento, de la banca local saltaron Erbin Trejo y el chileno Edson Puch, con la intención de recomponer el camino. Luego, Volpi detuvo un remate de cabeza de Oribe Pe ralla y Darwin pudo anotar el segundo para el América, pero voló su disparo. Los queretanos redoblaron esfuerzos, pero fue insuficiente para empatar. Henry Martin ilusiona ya a los fans, porque su primer gol oficial con América se suma al que hizo en la pretemporada con el conjunto. Además rompió la sequía goleadora de los azulcremas, que no anotaron en los cuatro partidos de Liguilla que disputaron eneltorneo pasado. vibras JEREMY MENEZ, refuerzo francés del América, tuiteó: Vamos compañeros, mucho éxito esta noche. Los apoyo a la distancia con muchas ganas de poder estar con ustedes muy pronto."
