id,authors,category,date,header,medium,format,genre,mediumType,price,section,text
68897259,['Gerardo Suárez'],PRENSA,2018-01-28T02:55:51Z,Gastan 200 mdp en demoliciones,Universal Gráfico,IMPRESO,Nota Informativa,Diario,11495.9,Al Día,"Gerardo Suárez IL SECRETARIO de Obras y Servicios dIgar Tungüí, aseguró que hasta el momento las autoridades capitalinas han gastado 200 millones de pesos para las demoliciones de edificios dañados por el sismo del 19 de septiembre pasado. Al presentar un balance de acciones, el funcionario puntualizó que hay cerca de 120 inmuebles de grandes dimensiones, como condominios, multifamiliares y edificios de varios pisos de altura que ameritan ser derribados. No todos los va a demoler la Secretaría de Obras, hay algunos que los están demoliendo las delegaciones, o los particulares, explicó. Hasta ahora, la dependencia capitalina se hace cargo de 38 inmuebles que ya fueron dicta minados para su derribo, de los cuales 13 ya fueron concluidos, 24 están en proceso y hay uno detenido por un amparo. MÁS DERRIBOS. El secretario informó que esta semana comenzaron cuatro demoliciones más de inmuebles con daño estructural, los cuales se ubican en Colima 366 y Chiapas 140, en la Cuauhtémoc, así como Xola 32 y Balsas 18, en Benito Juárez. Con éstos hay de momento 24 inmuebles en proceso de derribo, de los cuales en 16 ya hay trabajos en curso y en ocho se realizan labores preliminares como retiro de pertenencias y estudios. Detalló que en Génova 33, situado en la Zona Rosa, hay un 33% de avance, mientras que en la torre de Doctor Lucio 103, conocido como Osa Mayor, en la colonia Doctores, siguen los trabajos."
68634299,['Juan Arvizu'],PRENSA,2018-01-15T07:17:36Z,Vitral Político // La hora del palomeo,Universal Gráfico,IMPRESO,Columna Política,Diario,17770.0,Portada,"PARA LOS PRIÍSTAS llegó la fase del palomeo de candidatos a las Cámaras de Diputados y Senadores; es la hora de ser o no ser, como diría Shakespeare, en voz de Hamlet. Y desde la semana pasada, empezaron a circular extensas listas de prospectos con supuesto boleto al Senado, en los que hasta se leen nombres sin futuro. Con un escenario electoral incierto, desconcertante, de pronóstico reservado, la designación de candidatos en 2018 se ve compleja, porque combina numerosas variables legales, de conciliación del interés de grupos, de estrategias para conservar el poder presidencial. Se considera que brotarán innumerables listas y hacia jueves, viernes, podrían empezar a conocerse versiones más afinadas y certeras, y en febrero perfilarse las barajas finales para el Congreso de la Unión. La primera resultante que se busca en las listas, en esta costumbre clásica del presidencialismo, es que el Presidente de la República saliente incluya un grupo de poder y el candidato a relevarlo coloque a sus operadores, todos con el compromiso de mantener a su partido en Los Pinos. O sea, los priístas se la juegan en el palomeo en curso. VIDRIOS SUELTOS. La lectura es de malestar del PVEM, aliado del PRI, por la decisión de ir con el PRD por la gubernatura de Morelos, con reconocimiento expreso al gobernador saliente Graco Ramírez. Para darle lógica a este paso del partido de Jorge Emilio González Martínez, hay quienes voltean a ver la disputa por la designación de candidato en Chiapas, donde Verdes y priístas quieren abanderar la pelea por la gubernatura. VIDRIOS SUCIOS El lopezobradorista Miguel Barbosa Huerta asegura que José Antonio Meade transó con Rafael Moreno Valle su apoyo a cambio de que el PRI opere para que la esposa del ex gobernador, Martha Erika Alonso, sea candidata del PAN y gane el cargo, que se traduce en una maniobra reeleccionista. Esto sería una burla para los priístas HERRAJES. El senador priísta Emilio Gamboa Patrón va por el nombramiento de los fiscales General de la República y Anticorrupción, así como de los magistrados especializados en esta materia en el último periodo de sesiones del Congreso, de febrero a abril. Por su parte, el panista Fernando Herrera Ávila dice que este asunto será abordado por su bancada, con el cuidado de que las designaciones no sean a modo del PRI y su gobierno. VIDRIOS ROTOS. El gobernador Javier Corral Jurado va con todo contra el presidente Enrique Peña Nieto, a quien llama deshonesto, y de la Secretaría de que señala como embustera, por la retención de 780 millones de pesos de la Federación, como venganza por sus investigaciones de corrupción contra el ex gobernador César Duarte Jáquez. Reclama los recursos no recibidos y la deportación a México de su antecesor prófugo, contra quien se han dictado 10 órdenes de aprehensión. La ruptura institucional es evidente y Corral pide un fallo de la Suprema Corte para este enredo CONTRASTE. El coronel Jorge nuño Jiménez, estudioso de temas militares, señala que en lo que va del sexenio a las fuerzas armadas se les ocupa más en tareas de seguridad pública que de combate al narcotráfico. Establece que en materia de Seguridad Interior fallaron los ámbitos policiacos, y a la política no le quedó otra que echar mano del Ejército. La luz que pone nuño en esta problemática explica la utilidad de la Ley de Seguridad Interior, que se impugna en la Suprema Corte. MIRADOR. Sun Tzu, en El Arte de la Guerra: La defensa es para tiempos de escasez; el ataque para tiempos de abundancia."
68590362,['Redacción'],PRENSA,2018-01-12T03:47:22Z,Que se venga,Universal Gráfico,IMPRESO,Nota de Portada,Diario,46693.4,Deportes,"Rserá bienvenido, npiecen a armar la vaquita y ojala se lOnP EDITOR ROBERTO 8. CAST/ jgardac @elun¡versaLcoi DEPORTE TOTAL LOS CLUBES ingleses Arsenal, Newcastle, Everton, Crystal Palace, así como Los Ángeles de la MLS andan tras los huesitos de Javier Chicharito Hernández. Ello después de que el West Ham, donde milita el mexicano, anunció su disposición de escuchar ofertas por el delantero. En Chivas, el zaguero Jair Pereira pidió hacer la vaquita para que Javier regrese al corral; lo cierto es que Hernández tiene alborotado el gallinero ante la posibilidad de ser cedido a préstamo, pues su carta vale 20 millones de dólares. De acuerdo con Sky Sports, el West Ham no descarta cambiar al mexicano en este mes, todo debido a que desde la llegada David Moyes al timón del club, sólo lo ha utilizado en seis juegos, uno como titular y con apenas 120 minutos de acción. El propio Moyes fue quien echó del Manchester United al mexicano, cuando llegó a dirigir al club y por la sencilla razón de que no le gusta el estilo de Javier. De acuerdo al diario Daily Star, cuatro equipos de la Premier League y uno de la MLS suenan como posibles destinos de Hernández. Uno de ellos es el Arsenal, de Arsene Wenger; el Newcastle, del español Rafa Benítez; el Everton, de Sam Allardyce y el Crystal Palace, de Roy Hodgson; además del equipo Los Ángeles Football Club de la MLS. LO QUIERE. Mientras que en Chivas.Jair Pereira manifestó que el Chicharito recibiría todo el respaldo del equipo, si desea volver. Yo pongo una parte para que venga Chicharito. Es goleador nato, tiene una actitud impresionante, siempre quiere mejorar. Se va a armar la vaquita y ojalá venga, declaró Pereira. Agregó que Liga MX sería benéfica para el Javier ya que es más competente que la MLS. Si tomara la decisión de venir para acá, le va a servir en ritmo y más en Chivas, porque juega con dinámica y los conceptos que se manejan en Selección son muy parecidos, aseguró. Redacción"
68706961,['Redacción'],PRENSA,2018-01-18T13:38:35Z,El papá de los Pumas,Universal Gráfico,IMPRESO,Nota Informativa,Diario,28129.4,Deporte,"De vencer a Pumas, El Piojo será el técnic de América con más victori ante los felinos Jetatur TRIUNFOS en mismo número de partidos registra Herrera contra los auriazules al mando del América; está empatado con José Antonio Roca. Ariadna Montoya en la fecha tres ra 2018, Herrera se convertirá en el rey de las batallas por el orgullo ante los universitarios. INVICTO. Desde que El Piojo llegó al América ha enfrentado siete veces a la tropa del Pedregal y en todas ha salido vencedor. La paternidad comenzó en la fecha 11 del Clausura 2012 con marcador de 2-1. En el siguiente torneo, el Apertura 2012, las Águilas de Herrera volvieron a impocon un 0-1 en la jornada 15. El tercer triunfo llegó en el Clausura los de Coapa derrotaron 1-0 a su rival azul y oro en la fecha 15. En ese mismo certamen se enfrentaron en cuartos de final. El ave ganó 0-1 en la ida y 2-1 en la vuelta. Miguel Herrera sumó su sexta victoria ante los auriazules con un 1-4 en la fecha ocho del Apertura 2013. El torneo pasado registró su séptimo triunfo en fila ante tos felinos, 2-1 en el Azteca. DE LOS MÁS GANADORES. Herrera figura entre los tec nicos de las clásicos ganados ante Pumas, Chivas y Cruz Azul. Ocupa el tercer sitio, con 14 victorias ante los máximos rivales de la escuadra americanista: cuatro contra Chivas, tres ante La Máquina y siete contra los felinos. También Carlos Reinoso presume 14: siete ante El Rebaño, cuatro ante celestes y tres contra auriazules. Antes están Roca, con 21 ( 10 ante Chivas, cuatro ante Cruz Azul y siete ante Pu. mas así como Miguel ángel - López, con 15 ( siete ante roji blancos, cincoTremcotes y tres contra Pumas )"
68651391,['Redacción'],PRENSA,2018-01-16T03:38:26Z,Se enfrían al buscar calor con gas,Universal Gráfico,IMPRESO,Nota de Portada,Diario,25849.6,Portada,"Entre las víctimas, halladas en Ecatepec, está un nene de dos años casa percibieron el olor a llamaron a los bomberos. EN DOS hechos dis- gas que se desprendía de Cuando pudieron ingresar tintos, cinco perso- lacasa.ytrasllamarenva- encontraron a las dos víctinas, entre ellas un rías ocasiones ingresaron mas ya sin vida. Aparenteniño de dos años, murieron por la fuerza. Al entrar mente el gas se escapaba de por intoxicación con gas en La pareja aparentemente descubrieron los cuerpos una parrilla cuya manguera el municipio de Ecatepec. encendió el calentador de del matrimonio y su hijo. estaba conectada a un cilinEl primer caso ocurrió la agua para bañarse, pero el dro que también se enconnoche del domingo en el lugar no tenía ventilación OTRA PAREJA. En otro he- traba dentro del cuarto. fraccionamientoJardinesde Es probable que las vícti- cho, ayer por la mañana fue Los cadáveres de Leo N y Morelos, donde fueron halla- mas hubieran perdido el co- encontrada sin vida una pa- Gloria N, ambos de 29 dos sin vida Jesús N, de 27 nocimientoalinhalarelgasy reja dentro de su casa en la años, fueron llevados al Seraños; Lizbeth N, de 18, y sin nadie que los auxiliara fa- colonia Ampliación 19 de vicio Médico Forense de San Mateo, de 2. llecieron intoxicados. Septiembre. Cristóbal Redacción niño de dos años, murieron por la fuerza. Al entrar mente el gas se escapaba de por intoxicación con gas en La pareja aparentemente descubrieron los cuerpos una parrilla cuya manguera el municipio de Ecatepec. encendió el calentador de del matrimonio y su hijo. estaba conectada a un cilinEl primer caso ocurrió la agua para bañarse, pero el dro que también se enconnoche del domingo en el lugar no tenía ventilación OTRA PAREJA. En otro he- traba dentro del cuarto. fraccionamientoJardinesde Es probable que las vícti- cho, ayer por la mañana fue Los cadáveres de Leo N y Morelos, donde fueron halla- mas hubieran perdido el co- encontrada sin vida una pa- Gloria N, ambos de 29 dos sin vida Jesús N, de 27 nocimientoalinhalarelgasy reja dentro de su casa en la años, fueron llevados al Seraños; Lizbeth N, de 18, y sin nadie que los auxiliara fa- colonia Ampliación 19 de vicio Médico Forense de San Mateo, de 2. llecieron intoxicados. Septiembre. Cristóbal Redacción Sus familiares indicaron Las víctimas fueron enconque habían quedado de reu- tradas alrededor de las 7:00 nirse en casa de uno de ellos de la mañana en su vivienda el domingo al mediodía, pero localizada en las calles 8 de no llegaron alencuentro. Les Septiembre y Arboledas, marcaron por teléfono y no Según el reporte preliminar, hubo respuesta. los vecinos se dieron cuenta Por la noche acudieron a del intenso olor a gas, y al tobuscarlos. Al llegar a su car y no obtener respuesta casa percibieron el olor a llamaron a los bomberos. EN DOS hechos dis- gas que se desprendía de Cuando pudieron ingresar tintos, cinco perso- lacasa.ytrasllamarenva- encontraron a las dos víctinas, entre ellas un rías ocasiones ingresaron mas ya sin vida. Aparenteniño de dos años, murieron por la fuerza. Al entrar mente el gas se escapaba de por intoxicación con gas en La pareja aparentemente descubrieron los cuerpos una parrilla cuya manguera el municipio de Ecatepec. encendió el calentador de del matrimonio y su hijo. estaba conectada a un cilinEl primer caso ocurrió la agua para bañarse, pero el dro que también se enconnoche del domingo en el lugar no tenía ventilación OTRA PAREJA. En otro he- traba dentro del cuarto. fraccionamientoJardinesde Es probable que las vícti- cho, ayer por la mañana fue Los cadáveres de Leo N y Morelos, donde fueron halla- mas hubieran perdido el co- encontrada sin vida una pa- Gloria N, ambos de 29 dos sin vida Jesús N, de 27 nocimientoalinhalarelgasy reja dentro de su casa en la años, fueron llevados al Seraños; Lizbeth N, de 18, y sin nadie que los auxiliara fa- colonia Ampliación 19 de vicio Médico Forense de San Mateo, de 2. llecieron intoxicados. Septiembre. Cristóbal Redacción Sus familiares indicaron Las víctimas fueron enconque habían quedado de reu- tradas alrededor de las 7:00 nirse en casa de uno de ellos de la mañana en su vivienda el domingo al mediodía, pero localizada en las calles 8 de no llegaron alencuentro. Les Septiembre y Arboledas, marcaron por teléfono y no Según el reporte preliminar, hubo respuesta. los vecinos se dieron cuenta Por la noche acudieron a del intenso olor a gas, y al tobuscarlos. Al llegar a su car y no obtener respuesta casa percibieron el olor a llamaron a los bomberos. EN DOS hechos dis- gas que se desprendía de Cuando pudieron ingresar tintos, cinco perso- lacasa.ytrasllamarenva- encontraron a las dos víctinas, entre ellas un rías ocasiones ingresaron mas ya sin vida. Aparenteniño de dos años, murieron por la fuerza. Al entrar mente el gas se escapaba de por intoxicación con gas en La pareja aparentemente descubrieron los cuerpos una parrilla cuya manguera el municipio de Ecatepec. encendió el calentador de del matrimonio y su hijo. estaba conectada a un cilinEl primer caso ocurrió la agua para bañarse, pero el dro que también se enconnoche del domingo en el lugar no tenía ventilación OTRA PAREJA. En otro he- traba dentro del cuarto. fraccionamientoJardinesde Es probable que las vícti- cho, ayer por la mañana fue Los cadáveres de Leo N y Morelos, donde fueron halla- mas hubieran perdido el co- encontrada sin vida una pa- Gloria N, ambos de 29 dos sin vida Jesús N, de 27 nocimientoalinhalarelgasy reja dentro de su casa en la años, fueron llevados al Seraños; Lizbeth N, de 18, y sin nadie que los auxiliara fa- colonia Ampliación 19 de vicio Médico Forense de San Mateo, de 2. llecieron intoxicados. Septiembre. Cristóbal Redacción MIEMBROSde una familia murieron en su casa ubicada en Jardines de Morelos. Entre las víctimas, halladas en Ecatepec, está un nene de dos años casa percibieron el olor a llamaron a los bomberos. EN DOS hechos dis- gas que se desprendía de Cuando pudieron ingresar tintos, cinco perso- lacasa.ytrasllamarenva- encontraron a las dos víctinas, entre ellas un rías ocasiones ingresaron mas ya sin vida. Aparenteniño de dos años, murieron por la fuerza. Al entrar mente el gas se escapaba de por intoxicación con gas en La pareja aparentemente descubrieron los cuerpos una parrilla cuya manguera el municipio de Ecatepec. encendió el calentador de del matrimonio y su hijo. estaba conectada a un cilinEl primer caso ocurrió la agua para bañarse, pero el dro que también se enconnoche del domingo en el lugar no tenía ventilación OTRA PAREJA. En otro he- traba dentro del cuarto. fraccionamientoJardinesde Es probable que las vícti- cho, ayer por la mañana fue Los cadáveres de Leo N y Morelos, donde fueron halla- mas hubieran perdido el co- encontrada sin vida una pa- Gloria N, ambos de 29 dos sin vida Jesús N, de 27 nocimientoalinhalarelgasy reja dentro de su casa en la años, fueron llevados al Seraños; Lizbeth N, de 18, y sin nadie que los auxiliara fa- colonia Ampliación 19 de vicio Médico Forense de San Mateo, de 2. llecieron intoxicados. Septiembre. Cristóbal Redacción niño de dos años, murieron por la fuerza. Al entrar mente el gas se escapaba de por intoxicación con gas en La pareja aparentemente descubrieron los cuerpos una parrilla cuya manguera el municipio de Ecatepec. encendió el calentador de del matrimonio y su hijo. estaba conectada a un cilinEl primer caso ocurrió la agua para bañarse, pero el dro que también se enconnoche del domingo en el lugar no tenía ventilación OTRA PAREJA. En otro he- traba dentro del cuarto. fraccionamientoJardinesde Es probable que las vícti- cho, ayer por la mañana fue Los cadáveres de Leo N y Morelos, donde fueron halla- mas hubieran perdido el co- encontrada sin vida una pa- Gloria N, ambos de 29 dos sin vida Jesús N, de 27 nocimientoalinhalarelgasy reja dentro de su casa en la años, fueron llevados al Seraños; Lizbeth N, de 18, y sin nadie que los auxiliara fa- colonia Ampliación 19 de vicio Médico Forense de San Mateo, de 2. llecieron intoxicados. Septiembre. Cristóbal Redacción Sus familiares indicaron Las víctimas fueron enconque habían quedado de reu- tradas alrededor de las 7:00 nirse en casa de uno de ellos de la mañana en su vivienda el domingo al mediodía, pero localizada en las calles 8 de no llegaron alencuentro. Les Septiembre y Arboledas, marcaron por teléfono y no Según el reporte preliminar, hubo respuesta. los vecinos se dieron cuenta Por la noche acudieron a del intenso olor a gas, y al tobuscarlos. Al llegar a su car y no obtener respuesta casa percibieron el olor a llamaron a los bomberos. EN DOS hechos dis- gas que se desprendía de Cuando pudieron ingresar tintos, cinco perso- lacasa.ytrasllamarenva- encontraron a las dos víctinas, entre ellas un rías ocasiones ingresaron mas ya sin vida. Aparenteniño de dos años, murieron por la fuerza. Al entrar mente el gas se escapaba de por intoxicación con gas en La pareja aparentemente descubrieron los cuerpos una parrilla cuya manguera el municipio de Ecatepec. encendió el calentador de del matrimonio y su hijo. estaba conectada a un cilinEl primer caso ocurrió la agua para bañarse, pero el dro que también se enconnoche del domingo en el lugar no tenía ventilación OTRA PAREJA. En otro he- traba dentro del cuarto. fraccionamientoJardinesde Es probable que las vícti- cho, ayer por la mañana fue Los cadáveres de Leo N y Morelos, donde fueron halla- mas hubieran perdido el co- encontrada sin vida una pa- Gloria N, ambos de 29 dos sin vida Jesús N, de 27 nocimientoalinhalarelgasy reja dentro de su casa en la años, fueron llevados al Seraños; Lizbeth N, de 18, y sin nadie que los auxiliara fa- colonia Ampliación 19 de vicio Médico Forense de San Mateo, de 2. llecieron intoxicados. Septiembre. Cristóbal Redacción Sus familiares indicaron Las víctimas fueron enconque habían quedado de reu- tradas alrededor de las 7:00 nirse en casa de uno de ellos de la mañana en su vivienda el domingo al mediodía, pero localizada en las calles 8 de no llegaron alencuentro. Les Septiembre y Arboledas, marcaron por teléfono y no Según el reporte preliminar, hubo respuesta. los vecinos se dieron cuenta Por la noche acudieron a del intenso olor a gas, y al tobuscarlos. Al llegar a su car y no obtener respuesta casa percibieron el olor a llamaron a los bomberos. EN DOS hechos dis- gas que se desprendía de Cuando pudieron ingresar tintos, cinco perso- lacasa.ytrasllamarenva- encontraron a las dos víctinas, entre ellas un rías ocasiones ingresaron mas ya sin vida. Aparenteniño de dos años, murieron por la fuerza. Al entrar mente el gas se escapaba de por intoxicación con gas en La pareja aparentemente descubrieron los cuerpos una parrilla cuya manguera el municipio de Ecatepec. encendió el calentador de del matrimonio y su hijo. estaba conectada a un cilinEl primer caso ocurrió la agua para bañarse, pero el dro que también se enconnoche del domingo en el lugar no tenía ventilación OTRA PAREJA. En otro he- traba dentro del cuarto. fraccionamientoJardinesde Es probable que las vícti- cho, ayer por la mañana fue Los cadáveres de Leo N y Morelos, donde fueron halla- mas hubieran perdido el co- encontrada sin vida una pa- Gloria N, ambos de 29 dos sin vida Jesús N, de 27 nocimientoalinhalarelgasy reja dentro de su casa en la años, fueron llevados al Seraños; Lizbeth N, de 18, y sin nadie que los auxiliara fa- colonia Ampliación 19 de vicio Médico Forense de San Mateo, de 2. llecieron intoxicados. Septiembre. Cristóbal Redacción MIEMBROSde una familia murieron en su casa ubicada en Jardines de Morelos."
68570814,['Binoculares'],PRENSA,2018-01-11T05:32:39Z,Binoculares,Universal Gráfico,IMPRESO,Nota Informativa,Diario,6669.21,Nacional,"Golpeadores El día de ayer, el representante vecinal en la colonia San Miguel Chapultepec, Julio Higuera Elizondo, agredió a golpes al columnista de El Gráfico, Leo Agusb, luego de que éste, como un vecino más, le cuestionara por qué pintaron de color amarillo la fachada del Multifamiliar Tacubaya. Leo Agusto terminó en la enfermería con la mano izquierda lastimada y otras lesiones. Higuera Elizondo se ha distinguido por colaborar electoralmente con el diputado de la ALDF, Víctor Hugo Romo, quien para agradecer sus favores le gestionó una aviaduría, hecho que coloca al mapache al servicio de Romo como delincuente electoral en la Miguel Hidalgo. La violencia electoral promovida por el PRD en la Ciudad de México, y ahora por Romo desde Morena, alcanza una vez más a quienes ejercen el periodismo en la capital. Recientemente, Morena se quejó de las agresiones a periodistas en sus eventos, ahora ellos están igual. Sostiene mentiras Ante la pifia cometida por el procurador Edmundo Garrido y sus muchachos, el actor Abx Alejandro Arenas ya planea denunciar a los funcionarios públicos porque cuando lo detuvieron, les pidió oportunidad de presentarles las pruebas de que él no estaba en México cuando fue asesinada la modelo Karen Ailén, crimen que le imputaban. Garrido insiste en que había elementos para acusar al actor y asegura que no hubo errores en la dependencia a su cargo. Seguro apuesla a que el caso se olvide; lo buenos es que en su jefe, Miguel Ángel Mancera cabe la cordura y dice que si hay que ofrecer disculpas, se ofrecerán. Ola roja En Veracruz no termina la violencia: ayer fue asesinado el ex edil perredista de Colipa, Víctar Molina Dorantes, quien fue hallado en su casa en la zona centro del Estado. El gobernador Miguel Ángel Yunes ha sido incapaz de detener la violencia."
68841025,['Redacción'],PRENSA,2018-01-25T06:47:52Z,Profesor se desnuda y corretea a alumnos,Universal Gráfico,IMPRESO,Nota Informativa,Diario,12975.1,Mundo,"Un profesor de educación física se desnudó y corrió detrás de los estudiantes de segundo y quinto grado de la escuela primaria Carthay Center, en Los Angeles, California, EU. El incidente se produjo cuando los chicos realizaban ejercicios. Sin causa alguna, el docente se quitó la ropa y comenzó perseguir a los menores, que lograron escapar y refugiarse en varias aulas. Un obrero presenció la escena y grabó el momento en que el educador se pone de nuevo los pantalones para luego marcharse del sitio. YOUTUBE"
68497585,['Redacción'],PRENSA,2018-01-07T06:57:31Z,Fiesta de año nuevo termina en pelea masiva,Universal Gráfico,IMPRESO,Nota Informativa,Diario,9666.09,Nacional,"YOUTUBE FIESTA DE ANO NUEVO TERMINA EN PELEA MASIVA La celebración de Año Nuevo en un club nocturno de la ciudad siberiana de Yakutsk, Rusia, culminó en una golpiza masiva en la cola del guardarropa. El video, captado por la cámara de seguridad del local a altas horas de la madrugada, muestra cómo decenas de jóvenes participan en una brutal paliza."
