id,authors,category,date,header,medium,format,genre,mediumType,price,section,text
68756188,['Gabriel Cruz'],PRENSA,2018-01-21T08:46:43Z,Se hace grande,Universal Gráfico,IMPRESO,Nota Informativa,Diario,41805.4,Deporte,"Gabriel Cruz Eléctrico arrancó una nueva etapa en las filas del Consejo * Mundial de Lucha Libre, de, jando atrás al grupo de los ¿Pequeños Estrellas para ser parte del grupo estándar, pero no es el único que lo ha hecho: Virus, Demus y Astral lo hicieron en el pasado. El que mayor éxito ha tenido es Virus. Quien tras luchar como Bird Boy y Piratita Morgan, alcanzó un sitio distinto como Damiancito El Guerrero, personaje que lo llevó a ganar la eliminatoria realizada en la arena Coliseo en 1997, ante exponentes como Tritoncito y Fierito, un año después eligió al nombre de batalla que lo ha llevado a ser considerado en un maestro del pancracio. Como Virus, ha ganado las matas de Kato Kung Lee, Tony Rivera, Súper Brazo, Loco Max y Demus, a quien regresó a la categoría mini del CMLL. Eldemonio árabe, quien hoy destaca en el terreno independiente en México y en el extranjero, había seguido la misma ruta que Virus para ascender de categoría. Ganó el torneo bicentenario cele brado en la arena México pero en su afán de trascender retó al Pequeño Gigante a jugarse el lugar en un mano a mano, quien perdiera regresaría a los Pequeños Estrellas, el resultado mandó de regreso al ex Pequeño Damián que años después emigró de la empre CAMBIO DE FORMULA. El camino para llegar al grupo estándar entre los coliseínos cambió con el musculoso Astral. El mini ganó el torneo de fisicoculturismo como carta de presenta ción para debutar en el CMLL en 2009. En 2014 destapó a Pequeño Halcón y cuatro años después ya le quedaba muy grande a los rivales, así que la empresa decidió darle la alternativa, aunque hasta el momento no ha pasado mucho con él, salvo que ha seguido ganando las competencias de fortachones. Toca el turno a Eléctrico. El científico también ha destacado por su buen trabajo en el gimnasio y como Pequeño Estrella acabó con la incógnila de Pequeño Black Warrior, en el 2010. Casi ocho años después, se ha estrenadocon los mayores con el objetivo de destacar pronto en un elenco lleno de talento en el que es difícil hacerse de un lugar. EN LA MIRA. El ocaso para los Pequeños Estrellas es inminente, así que en un fu arturo no muy lejano más lu chadores de ese grupo po drían seguir a sus ex colé gas de concepto. Pequeño Pierroth y Stukita tienen el perfil suficiente para lo grarlo. Gabriel Cruz Eléctrico arrancó una nueva etapa en las filas del Consejo * Mundial de Lucha Libre, de, jando atrás al grupo de los ¿Pequeños Estrellas para ser parte del grupo estándar, pero no es el único que lo ha hecho: Virus, Demus y Astral lo hicieron en el pasado. El que mayor éxito ha tenido es Virus. Quien tras luchar como Bird Boy y Piratita Morgan, alcanzó un sitio distinto como Damiancito El Guerrero, personaje que lo llevó a ganar la eliminatoria realizada en la arena Coliseo en 1997, ante exponentes como Tritoncito y Fierito, un año después eligió al nombre de batalla que lo ha llevado a ser considerado en un maestro del pancracio. Como Virus, ha ganado las matas de Kato Kung Lee, Tony Rivera, Súper Brazo, Loco Max y Demus, a quien regresó a la categoría mini del CMLL. Eldemonio árabe, quien hoy destaca en el terreno independiente en México y en el extranjero, había seguido la misma ruta que Virus para ascender de categoría. Ganó el torneo bicentenario cele brado en la arena México pero en su afán de trascender retó al Pequeño Gigante a jugarse el lugar en un mano a mano, quien perdiera regresaría a los Pequeños Estrellas, el resultado mandó de regreso al ex Pequeño Damián que años después emigró de la empre CAMBIO DE FORMULA. El camino para llegar al grupo estándar entre los coliseínos cambió con el musculoso Astral. El mini ganó el torneo de fisicoculturismo como carta de presenta ción para debutar en el CMLL en 2009. En 2014 destapó a Pequeño Halcón y cuatro años después ya le quedaba muy grande a los rivales, así que la empresa decidió darle la alternativa, aunque hasta el momento no ha pasado mucho con él, salvo que ha seguido ganando las competencias de fortachones. Toca el turno a Eléctrico. El científico también ha destacado por su buen trabajo en el gimnasio y como Pequeño Estrella acabó con la incógnila de Pequeño Black Warrior, en el 2010. Casi ocho años después, se ha estrenadocon los mayores con el objetivo de destacar pronto en un elenco lleno de talento en el que es difícil hacerse de un lugar. EN LA MIRA. El ocaso para los Pequeños Estrellas es inminente, así que en un fu arturo no muy lejano más lu chadores de ese grupo po drían seguir a sus ex colé gas de concepto. Pequeño Pierroth y Stukita tienen el perfil suficiente para lo grarlo."
68513011,['Redacción'],PRENSA,2018-01-08T11:57:27Z,"Ole, El viaje de Ferdinand",Universal Gráfico,IMPRESO,Nota Informativa,Diario,2339.97,Espectaculos,"Ole, El Viaje de Ferdinand Infantil /108 min Ferdinand es un novillo tranquilo que prefiere sentarse a oler las flores que saltar. Un día unos hombres vienen buscando el toro más bravo y Ferdinand es elegido equivocadamente para las corridas de toros de Madrid."
68766384,['Juan Arvizu'],PRENSA,2018-01-22T03:03:56Z,Vitral Político // La carreta de calabazas,Universal Gráfico,IMPRESO,Columna Política,Diario,17646.2,Voces,"ALLÍ VA LA CARRETA de las elecciones de 2018 y como dice el dicho, al avanzar, las calabazas de acomodan. Hoy se reporta una rebelión en Chiapas, de parte de diputados locales y alcaldes del PVEM, inconformes con su cúpula que deja en el PRI la designación de candidato a gobernador. Es decir, los aliados se pelean. En la Ciudad de México, una panista de gran talla, Gabriela Cuevas Barrón, cambia de carril y se pasa al lado de Andrés Manuel López Obrador, el adversario del PAN en el desafuero. Ella pagó la fianza de dos mil pesos para que el entonces jefe de Gobierno, en desacato, no fuera a la cárcel. Se trata de la primera recluta que incorpora Tatiana Clouthier de las filas panistas. El CEN del PAN le dio la despedida a Cuevas con la revelación de que exigía una diputación federal plurinominal que no se le garantizó. La senadora es presidenta de la Unión Interparlamentaria y para ocupar ese cargo mundial, hay que ser legislador. Había señalamientos de que el senador del PVEM, Luis Armando Melgar Bravo, había renunciado al partido, en reacción a la virtual asignación de la candidatura por Chiapas a favor del priista Roberto Albores Gleason, quien está muy abajo del morenista Rutilio Escandón, que tiene en el bolsillo el cargo. Con todo lo que sabe de ideología de izquierda, el futbolista Cuauhtémoc Blanco, el 10 del América, alcalde de Cuernavaca, será candidato de Morena a gobernador de Morena. Las calabazas se acomodan con la carreta en marcha HERRAJEAbierto el mecanismo en el PRI para designar candidato al Senado, entre los diputados federales son considerados con fuerza César Camacho Quiroz, Jorge Carlos Ramírez Marín, Yericó Abramo Masso, Carolina Viggiano Austria, Martha Hilda González Calderón, Carlos Hiriarte Mercado, Carolina Monroy Del Mazo, Sylvana Beltrones, Pablo Gamboa Miner, Mariana Benítez Tiburcio, Martha Tamayo Morales, Marco Antonio García Ayala VIDRIOS ROTOS En el caso de Chihuahua, entre los priistas que se promueven para aparecer en las listas de representación proporcional se menciona a José Reyes Baeza Terrazas, quien gobernó la entidad en el periodo de 2004 a 2010, tiempo en el cual crecieron las actividades del crimen organizado en la entidad. El aspirante a la Cámara Alta, entonces enfrentó señalamientos de colusión con el cártel de Juárez, de un testigo protegido, lo cual negó, y el escándado se apagó. Ninguna autoridad lo exoneró ni lo inculpó. Ocho años después, los escenarios son distintos: La rendición de cuentas y la transparencia son filtros por los que pasan quienes buscan aparecer en las boletas electorales COBRE Raúl Cervantes Andrade hablará de seguridad y justicia, hoy en Durango, ante José Antonio Meade Kuribreña. Será su reaparición y, sin duda, podrá puntualizar el tema Anticorrupción. El hecho es que el ex presidente del Senado acompañará al abanderado presidencial del PRI en la contienda por la Presidencia de la República VENTANAL Emilio Gamboa Patrón va por la aprobación del fiscal Anticorrupción en el Senado, en el periodo de sesiones de febrero a abril, tema que será la prioridad para los priistas, junto con los magistrados que requiere el Sistema Nacional Anticorrupción para estar completo. Pero ya se registran posiciones que conforman un escenario complejo, pues Luis Sánchez, coordinador del PRD, dice que se deben realizar reformas a la Constitución, aprobar una Ley Orgánica de la Fiscalía General de la República. Gamboa repara que no se trata de nombrar un fiscal Anticorrupción a modo, sino de que los senadores cumplan su obligación de designar al persecutor de fechorías MIRADOR. Benito Juárez: En nuestras libres instituciones, el pueblo mexicano es el árbitro de su suerte En la Ciudad de México, una panista de gran talla, Gabriela Cuevas Barrón, cambia de carril y se pasa al lado de Andrés Manuel López Obrador, el adversario del PAN en el desafuero Se trata de la primera recluta que incorpora Tatiana Clouthier de las filas panistas."
68456602,['Redacción'],PRENSA,2018-01-04T03:28:54Z,A cómplice se le sale tiro y mata a su cuate,Universal Gráfico,IMPRESO,Nota Informativa,Diario,6451.25,La Roja,"UN PRESUNTO delincuente fue asesinado de manera accidental por uno de sus cómplices durante el robo a una tienda de abarrotes en el municipio de Acolman. El homicidio ocurrió ayer por la tarde en el establecimiento Capricornio, ubicado en la calle Hidalgo, en el por bladodeTepexpan. De acuerdo con el reporte de la policía municipal, tres sujetos llegaron a bordo de tres motos a la tienda y a punta de pistola amagaron al encargado, al que le exigieron el dinero de las ventas del día. Mientras cometían el atraco, a uno de los asaltantes se le disparó por error el arma que portaba. Ese proyectil alcanzó a uno de sus cómplices, quien cayó herido en la entrada del negocio. Aunque sus amigos intentaron reanimarlo, el presunto ladrón no reaccionó y eLlos huyeron ante eltemor de ser descubiertos por policías. Al lugar llegó la unidad de Protección Civil 03 de Teotihuacán, cuyos paramédicos verificaron que el sujeto, quien hasta anoche no había sido identificado, ya no tenía signos vitales. Redacción EL PRESUNTO malhechor se desplomó en el negocio."
68696736,['Redacción'],PRENSA,2018-01-18T04:53:51Z,Comando ultima a herido,Universal Gráfico,IMPRESO,Nota de Portada,Diario,39597.6,Portada,"EN HOSPITAL DE GUANAJUATO Comando ultima a herido LUEGO DE SER hospitalizado tras una balacera, un hombre fue rematado por un comando armado que entró al nosocomio en el municipio de Salvatierra, Guanajuato. En el ataque, los sicarios mataron a un policía que custodiaba al paciente herido. El primer ataque se registró la noche del martes en una vivienda en la calle Las Flores del fraccionamiento Hacienda del mismo municipio, donde un comando armado asesinó a tres mujeres y dos hombres, dejando herida a otra persona que fue llevada de emergencia al Hospital General de Salvatierra. Debido a que las víctimas estaban ligadas al crimen organizado, las autoridades pusieron un policía a la custodia del herido que era atendido en el nosocomio. ECHAN BALA. Sin embargo, ayer, cerca de las 8:30 de la mañana, otro comando ingresó violentamente al hospital haciendo disparos mientras eran grabados por las cámaras de seguridad de la institución. Los sicarios primero abatieron a balazos al policía que vigilaba, luego entraron a la habitación del sobreviviente y lo acribillaron a tiros, además de que hirieron a otra persona. HUYEN EN CAMIONETA. Una vezconsumadoel ataque, los sujetos escaparon a bordo de una camioneta, mientras que el personal del hospital dio aviso a los cuerpos de emergencia. Al sitio llegaron elementos de Seguridad Pública Municipal, del Ejército mexicano, y de la Policía Ministerial, así como personal de Servicios Periciales y de Investigación Especializada en Homicidios. El hospital quedó fuertemente custodiado, hasta que llegaron peritos del Servicio Médico Forense y de la Procuraduría General de Justicia del estado de Guanajuato para hacer las indagatorias y llevar a cabo el levantamiento de los cuerpos para llevarlos al anfiteatro. En tanto, los agentes investigadores recabaron indicios para esclarecer los hechos y buscar a los responsables. Trascendió que la víctima que sobrevivió al primer ataque tenía por nombre Gerardo Lara. Debido a la gran movilización policiaca, se suspendieron los servicios de Consulta Externa y otros no prioritarios en el nosocomio, además se evacuó a las personas que esperaban atención no hospitalaria. Redacción"
68766403,['Leo Agusto'],PRENSA,2018-01-22T03:30:11Z,Submarino Político // La pejestroika,Universal Gráfico,IMPRESO,Columna Política,Diario,19217.2,Voces,"Andrés manuel López Obrador aprovechó las acusaciones de la injerencia rusa en su campaña para mofarse de sus rivales y desde el malecón del heroico puerto de Veracruz lanzó un video donde dijo esperar un submarino ruso con oro proveniente de Moscú. El stand up desarticuló la arenga de sus críticos y desató en redes sociales las risas de los millennials, sector de la población votante que podría definir la elección presidencial. Ahora sabemos que el submarino ruso no traía oro, pero sí dos encuestas cuchareadas donde el tabasqueño aparece en altísimo primer lugar, muy por encima del frentista Ricardo Anaya y el ciudadano José Antonio Meade. Uno de los estudios de opinión fue supuestamente elaborado por el Gabinete de Comunicación Estratégica que preside Liébano Sáenz. Más temprano que tarde, fue desmentido por el mismo Liébano y aclaró que en esta elección su casa encuestadora no realiza ningún seguimiento (tracking) diario de preferencias de la elección presidencial. Ayer platiqué con el poderoso ex secretario particular del presidente Ernesto Zedillo y me confirmó que dicha encuesta no era de ellos y que en los últimos estudios que realizó el Gabinete, publicados en el sitio web de la empresa, el morenista aparecía en primer lugar y que no entendía por qué López Obrador presentaba estudios falsos como ciertos. Ante esta situación, sólo hay dos opciones: o López Obrador es un mentiroso o sus colaboradores le están mintiendo. Lo cierto es que la apuesta del PRI es una elección cerrada, al estilo 2006, para ganar la Presidencia en la mesa y no en las urnas, y es una de las razones por las que se ha impugnado la Ley de Seguridad Interior, luego de ver el resultado de la elección presidencial en Honduras, donde la fuerza pública acalló la protesta popular. El tabasqueño sabe que una elección cerrada lo pondría mucho más cerca de su tercera derrota presidencial. Es por ello que ayer sumó a las filas de Morena a la senadora Gabriela Cuevas, quien ya renunció a Acción Nacional y ya fue jefa delegacional en Miguel Hidalgo; y con Víctor Hugo Romo fuera de la ecuación, tendrá un interesante mano a mano con la diputada de la ALDF, Margarita Martínez Fisher, que se perfila como la apuesta del frente PAN, PRD, MC para la alcaldía en Miguel Hidalgo. Para que Morena pueda ganar la jefatura de gobierno de la Ciudad de México debe sumar a las disidencias que cuenten con base social y capital político, pero es muy difícil encontrar perfiles que cumplan con dichos requisitos, por eso personajes como René Bejarano y Dolores Padierna serán elementos clave en la elección capitalina. De la honestidad valiente, mejor ni hablamos. Y ayer mismo, López Obrador anunció la incorporación de Cuauhtémoc Blanco como el 10 natural para competir por la gubernatura del sureño estado de Morelos. El senador Rabindranath Salazar, que fue uno de los primeros en la Cámara Alta, quedó fuera de la carrera electoral debido a que el ídolo del fútbol mexicano fue la apuesta del Partido Encuentro Social. Los albazos no han dejado nada contentos ni a los leales ni a los duros de Morena, pero la apuesta del tabasqueño es sumar la mayor cantidad de votos para acabar con el priismo, pero no con el partido entero, sino con el ala de la tecnocracia que respalda a José Antonio Meade, aunque para ello tenga que sumar a la extrema derecha representada por el PES, a la disidencia panista que no coincide con Anaya, a los perredistas arrepentidos y pasar por encima de los postulados de la izquierda, traicionando a sus militantes. La estrategia electoral de López Obrador se parece mucho al sistema de reformas estructurales emprendidas por otro ruso, Mijail Gorvachov, en los años 80 del siglo pasado, conocido como la Perestroika, cuyo momento cumbre quedó plasmado con la caída del muro de Berlín. López Obrador dice que quiere pacificar al país luego de 12 años de guerra contra el narco. Aunque para ello deba mentir, robar y traicionar como Gorvachov, quien es recordado como uno de los máximos traidores del comunismo."
68742722,['Redacción'],PRENSA,2018-01-20T07:48:01Z,Preso un joven por ataque a una escuela con hacha y bomba molotov,Universal Gráfico,IMPRESO,Nota Informativa,Diario,12486.8,Mundo,"La policía arrestó ayer a un alumno de 16 años, responsabilizándolo de causar al menos seis heridos, tras atacar, con un hacha y cóctel molotov, a estudiantes de una escuela de Ulan-Ude en Buriatia, en el sur de Siberia. El adolescente, quien ha sido hospitalizado, había anticipado sus violentos planes a una de las alumnas de la institución. PERSONAS resultaron lesionadas tras el ataque del muchacho."
68594467,['Redacción'],PRENSA,2018-01-12T07:27:00Z,A bajar la cortina ante los Tuzos,Universal Gráfico,IMPRESO,Nota Informativa,Diario,11813.5,Deportes,"América ha recibido 11 goles de Pachuca en los últimos tres duelos en el Azteca Ariadna Montoya EN LOS recientes días se ha hablado mucho de la ofensiva del América con sus refuerzos extranjeros, pero lo que el equipo deberá cuidar este sábado ante Pachuca es su defensa. Los Tuzos le han anotado 11 goles a las Águilas en sus últimas tres visitas y se han llevado el triunfo. En el Clausura 2017 los de Coapa cayeron 2-3 ante los hidalguenses en la fecha 17. Antes perdieron 1-4 en la jornada tres del Clausura 2016 y 3-4 en la vuelta de los cuartos de final del Clausura 2015. Para los pupilos de Miguel Herrera es urgente hacer valer su localía en el Clausura 2018, luego de que el torneo pasado sólo ganaron tres duelos en su casa. Y un buen camino para lograrlo es mantener el cero ante Pachuca en el Coloso de Santa Úrsula y conservar su meta imbatible en el certamen luego de vencer 0-1 a Gallos en la fecha uno. MARCHESÍN, CLAVE. El portero azulcrema Agustín Marchesín será una figura clave. El argentino ya sabe a la perfección resguardar su valla de todo peligro. Así lo demostró en el Clausura 2017, cuando se convirtió en el primer arquero emplumado en conseguir 586 minutos sin recibir gol en el Azteca. Los de Coapa superaron esa vez lo hecho en la temporada 1986-1987, cuando sumaron 576 minutos sin ver caído su marco. MUCHOS GOLES. Este sábado, la zona baja del América deberá estar muy atenla para no llevarse otro trago amargo en su propio patio ante Pachuca. Sobre todo porque los duelos entre ambos contrincantes suelen estar llenos de goles. Prueba de ello es que en torneos cortos se han enfrentado en 50 ocasiones y sólo en cuatro partidos el marcador ha finalizado con un 0-0 sin chispa."
68548386,['Juan Arvizu'],PRENSA,2018-01-10T05:34:17Z,Vitral Político // Ayuno de debate,Universal Gráfico,IMPRESO,Columna Política,Diario,17073.8,Voces,"VITRAL político JUAN ARVIZU ARRIOJA JUAN ARVIZU ARRIOJA LAS PRECAMPAÑAS de los presidenciables van dirigidas a cultivar empatia con los electores y también con el gran público que recibe la información de sus actividades, mientras sus equipos se bombardean con señalamientos lodosos. Se pierde el tiempo para que expongan propuestas ante los problemas del país, que lo son de la gente, de los millones y millones de electores en cuyas manos está el nombre de quien gobernará México el próximo sexenio y, si es el caso, qué régimen político se instituiría. Ha venido el secretario general de la Organización para la Cooperación y Desarrollo Económicos ( OCDE el mexicano José Ángel Gurría Treviño, y junto con la felicitación por el paquete de grandes reformas, deja el señalamiento del faltante del sexenio, los asuntos del Estado de Derecho, la justicia y la seguridad pública. El dictamen es sencillo: la administración hizo bien en los cambios que dirigió mayormente en el ámbito económico, pero hubo estancamiento en materias que tienen como común denominador la aplicación de las leyes. De esto debería hablarse en las campañas políticas, antes que en descalificar las propuestas antagónicas, y así hay un ayuno de debate de ideas en asuntos principales. Hacen falta más propuestas y menos ruido VENTANAL. Se sabe que Miguel Ángel Osorio Chong deja la Secretaría de Gobernación, y se considera que figure entre los candidatos al Senado por representación proporcional. Sería, eventualmente, coordinador de la bancada priísta. Este paso anticipado supone que el hidalguense trabaje en las líneas de combate electoral para que su grupo parlamentario sea el del partido en el poder. Todo esto está por escribirse CONTRALUZ. Javier Lozano Alarcón renunció al PAN, partido que se ha desdibujado, dice en una carta enviada al presidente sustituto del CEN de Acción Nacional, Damián Zepeda Vidales, y acusa que al integrarse al Frente, dicho partido vició su plataforma ideológica y actúa en un reparto de botín político. La despedida se la dio el coordinador de la bancada senatorial, Fernando Herrera Ávila, quien señaló que Lozano ya se había alejado del PAN y sólo formaliza una decisión en un contexto político electoral que no le es favorable para sus pretensiones políticas en Puebla. El senador Roberto Gil Zuarth, como Lozano, uno de Los Rebeldes en la Cámara Alta, saludó la decisión del poblano con una indicación implícita de que el chiapaneco se queda, aunque contra él también hay denuncias en la Comisión de Disciplina Intrapartidaria, y por lógica emprendería el vuelo VIDRIOS SUELTOS. Salió a relucir el gasolinazo, no el falso de este enero, sino el catastrófico de 2017, en el informe de la iflación anual a cargo del INEGI. El reporte arroja que entre las causas de la alta inflación de 6.77 la más alta en tres lustros, están los incrementos a la gasolina y al gas LP. Aquella decisión, que levantó un gran malestar social, tuvo un manejo torpe en los medios de comunicación y todavía ahora se pretende endosar responsabilidades a José Antonio Meade, quien era titular de Hacienda HERRAJES. Manlio Fabio Beltrones Rivera obtuvo amparo en el caso de supuestos desvíos de recursos del gobierno de Chihuahua, para campañas del PRI, en 2015. Este episodio ya incluye un choque entre el gobernador Javier Corral y el presidente Enrique Peña Nieto, pues el norteño reclama partidas extraordinarias que no recibe, dice, en represalia federal MIRADOR. Durante su visita a México, hace casi dos años, en Ecatepec, en relación con el narcotráfico y los cárteles, el papa Francisco dijo a sus fieles: Metámoslo en la cabeza, con el demonio no se dialoga, porque nos va a ganar siempre Se pierde el tiempo para que ( los presidenciables ) expongan propuestas ante los problemas del país, que lo son de la gente, de los millones y millones de electores"
