id,authors,category,date,header,medium,format,genre,mediumType,price,section,text
68590115,['Yara Silva'],PRENSA,2018-01-12T03:35:37Z,El Cochi cae en el norte,Universal Gráfico,IMPRESO,Nota de Portada,Diario,62443.6,La Roja,"ES SUCESOR DE EL OJOS; aquí DETIENEN A DOS COMPLICES, pág.s ELEMENTOS DE LA MARINA desplegaron un operativo en las delegaciones Iztacalco y Venustiano Carranza, donde aprehendieron a dos cómplices ( padre e hijo ) del capo. EL OJOS FELIPE DE JESUS PEREZ LUNA fue abatido en Tláhuac el 20 de julio de 2017. URIEL ISAAC llevaba medio kilo de cristal cuando lo apañaron. URIEL ISAAC, El Cochi, fue detenido en Monterrey, Nuevo Y/ León. El presunto sucesor de El Ojos y del Cártel de WJ Tláhuac operaba desde el norte y había tomado domicilios en las delegaciones ELEMENTOS de la Iztacalco y Venustiano Ca- Marina y de la Policía rranza, en la capital del país, Federal participaron como centro de distribución. los cateos. Al ser aprehendido le aseguraron medio kilo de la droga conocida como cristal. Al momento de su arresto De manera simultánea fue- Rubén y su hijo tenían en su ron detenidos dos de sus pre- poder 12 armas largas, más suntos cómplices en la Ciudad de un kilo de cocaína y dinede México. Se trata de Rubén ro en efectivo. Laredo Rodríguez y su hijo Ru- Según declaraciones de los bénLaredoChávez. vecinos, los presuntos delinPadre e hijo se ocultaban en cuentes llegaron a Iztacalco domicilios de las delegado- días después de que Felipe de nes Venustiano Carranza e Iz- Jesús Pérez Luna, El Ojos, tacalco, en este último fueron fuera abatido por elementos detenidos. El inmueble de la de la Marina en Tláhuac el 20 colonia Picos es una casa de de julio del año pasado, tres niveles ubicada en el Ca- La marca del cártel quedó en Uejónl2yCallejón6. los homicidios ocurridos en colonias de Iztacalco, en donCATEAN CASA DE SANTE- de el narcotraficante tomó el ROS. La madrugada de ayer mando, personal de la Marina y de la Quienes viven en la zona diPolicía Federal realizó un ca- cen que en el domicilio aseguteo. Ahí, en el predio con ador- rado solían reunirse grupos de nos de santería, fachada de hombres, que a su vez acecomercio y dos puertas de ac- chaban a los habitantes de la ceso se escondían los cómpli- colonia. Dicen que eran sus cesdeElCochi. halcones y vendedores de Los miembros del Cártel de droga. Tláhuac eran buscados desde El Cochi y sus cómplices hace meses por la Secretaría fueron trasladado a las instade Marina y la Policía Federal, laciones de la SubprocuraduPor ello 60 elementos realiza- ría Especializada en Investigaron ayer el cateo, en donde las ción de Delincuencia Organicapturas se realizaron sin rea- zada ( SEIDO ) ubicadas en Palizar disparos. seo de la Reforma. conocida como cristal. Al momento de su arresto De manera simultánea fue- Rubén y su hijo tenían en su ron detenidos dos de sus pre- poder 12 armas largas, más suntos cómplices en la Ciudad de un kilo de cocaína y dinede México. Se trata de Rubén ro en efectivo. Laredo Rodríguez y su hijo Ru- Según declaraciones de los bénLaredoChávez. vecinos, los presuntos delinPadre e hijo se ocultaban en cuentes llegaron a Iztacalco domicilios de las delegado- días después de que Felipe de nes Venustiano Carranza e Iz- Jesús Pérez Luna, El Ojos, tacalco, en este último fueron fuera abatido por elementos detenidos. El inmueble de la de la Marina en Tláhuac el 20 colonia Picos es una casa de de julio del año pasado, tres niveles ubicada en el Ca- La marca del cártel quedó en Uejónl2yCallejón6. los homicidios ocurridos en colonias de Iztacalco, en donCATEAN CASA DE SANTE- de el narcotraficante tomó el ROS. La madrugada de ayer mando, personal de la Marina y de la Quienes viven en la zona diPolicía Federal realizó un ca- cen que en el domicilio aseguteo. Ahí, en el predio con ador- rado solían reunirse grupos de nos de santería, fachada de hombres, que a su vez acecomercio y dos puertas de ac- chaban a los habitantes de la ceso se escondían los cómpli- colonia. Dicen que eran sus cesdeElCochi. halcones y vendedores de Los miembros del Cártel de droga. Tláhuac eran buscados desde El Cochi y sus cómplices hace meses por la Secretaría fueron trasladado a las instade Marina y la Policía Federal, laciones de la SubprocuraduPor ello 60 elementos realiza- ría Especializada en Investigaron ayer el cateo, en donde las ción de Delincuencia Organicapturas se realizaron sin rea- zada ( SEIDO ) ubicadas en Palizar disparos. seo de la Reforma. URIEL ISAAC, El Cochi, fue detenido en Monterrey, Nuevo Y/ León. El presunto sucesor de El Ojos y del Cártel de WJ Tláhuac operaba desde el norte y había tomado domicilios en las delegaciones ELEMENTOS de la Iztacalco y Venustiano Ca- Marina y de la Policía rranza, en la capital del país, Federal participaron como centro de distribución. los cateos. Al ser aprehendido le aseguraron medio kilo de la droga ELEMENTOS DE LA MARINA desplegaron un operativo en las delegaciones Iztacalco y Venustiano Carranza, donde aprehendieron a dos cómplices ( padre e hijo ) del capo. URIEL ISAAC, El Cochi, fue detenido en Monterrey, Nuevo Y/ León. El presunto sucesor de El Ojos y del Cártel de WJ Tláhuac operaba desde el norte y había tomado domicilios en las delegaciones ELEMENTOS de la Iztacalco y Venustiano Ca- Marina y de la Policía rranza, en la capital del país, Federal participaron como centro de distribución. los cateos. Al ser aprehendido le aseguraron medio kilo de la droga conocida como cristal. Al momento de su arresto De manera simultánea fue- Rubén y su hijo tenían en su ron detenidos dos de sus pre- poder 12 armas largas, más suntos cómplices en la Ciudad de un kilo de cocaína y dinede México. Se trata de Rubén ro en efectivo. Laredo Rodríguez y su hijo Ru- Según declaraciones de los bénLaredoChávez. vecinos, los presuntos delinPadre e hijo se ocultaban en cuentes llegaron a Iztacalco domicilios de las delegado- días después de que Felipe de nes Venustiano Carranza e Iz- Jesús Pérez Luna, El Ojos, tacalco, en este último fueron fuera abatido por elementos detenidos. El inmueble de la de la Marina en Tláhuac el 20 colonia Picos es una casa de de julio del año pasado, tres niveles ubicada en el Ca- La marca del cártel quedó en Uejónl2yCallejón6. los homicidios ocurridos en colonias de Iztacalco, en donCATEAN CASA DE SANTE- de el narcotraficante tomó el ROS. La madrugada de ayer mando, personal de la Marina y de la Quienes viven en la zona diPolicía Federal realizó un ca- cen que en el domicilio aseguteo. Ahí, en el predio con ador- rado solían reunirse grupos de nos de santería, fachada de hombres, que a su vez acecomercio y dos puertas de ac- chaban a los habitantes de la ceso se escondían los cómpli- colonia. Dicen que eran sus cesdeElCochi. halcones y vendedores de Los miembros del Cártel de droga. Tláhuac eran buscados desde El Cochi y sus cómplices hace meses por la Secretaría fueron trasladado a las instade Marina y la Policía Federal, laciones de la SubprocuraduPor ello 60 elementos realiza- ría Especializada en Investigaron ayer el cateo, en donde las ción de Delincuencia Organicapturas se realizaron sin rea- zada ( SEIDO ) ubicadas en Palizar disparos. seo de la Reforma. conocida como cristal. Al momento de su arresto De manera simultánea fue- Rubén y su hijo tenían en su ron detenidos dos de sus pre- poder 12 armas largas, más suntos cómplices en la Ciudad de un kilo de cocaína y dinede México. Se trata de Rubén ro en efectivo. Laredo Rodríguez y su hijo Ru- Según declaraciones de los bénLaredoChávez. vecinos, los presuntos delinPadre e hijo se ocultaban en cuentes llegaron a Iztacalco domicilios de las delegado- días después de que Felipe de nes Venustiano Carranza e Iz- Jesús Pérez Luna, El Ojos, tacalco, en este último fueron fuera abatido por elementos detenidos. El inmueble de la de la Marina en Tláhuac el 20 colonia Picos es una casa de de julio del año pasado, tres niveles ubicada en el Ca- La marca del cártel quedó en Uejónl2yCallejón6. los homicidios ocurridos en colonias de Iztacalco, en donCATEAN CASA DE SANTE- de el narcotraficante tomó el ROS. La madrugada de ayer mando, personal de la Marina y de la Quienes viven en la zona diPolicía Federal realizó un ca- cen que en el domicilio aseguteo. Ahí, en el predio con ador- rado solían reunirse grupos de nos de santería, fachada de hombres, que a su vez acecomercio y dos puertas de ac- chaban a los habitantes de la ceso se escondían los cómpli- colonia. Dicen que eran sus cesdeElCochi. halcones y vendedores de Los miembros del Cártel de droga. Tláhuac eran buscados desde El Cochi y sus cómplices hace meses por la Secretaría fueron trasladado a las instade Marina y la Policía Federal, laciones de la SubprocuraduPor ello 60 elementos realiza- ría Especializada en Investigaron ayer el cateo, en donde las ción de Delincuencia Organicapturas se realizaron sin rea- zada ( SEIDO ) ubicadas en Palizar disparos. seo de la Reforma. URIEL ISAAC, El Cochi, fue detenido en Monterrey, Nuevo Y/ León. El presunto sucesor de El Ojos y del Cártel de WJ Tláhuac operaba desde el norte y había tomado domicilios en las delegaciones ELEMENTOS de la Iztacalco y Venustiano Ca- Marina y de la Policía rranza, en la capital del país, Federal participaron como centro de distribución. los cateos. Al ser aprehendido le aseguraron medio kilo de la droga URIEL ISAAC, El Cochi, fue detenido en Monterrey, Nuevo Y/ León. El presunto sucesor de El Ojos y del Cártel de WJ Tláhuac operaba desde el norte y había tomado domicilios en las delegaciones ELEMENTOS de la Iztacalco y Venustiano Ca- Marina y de la Policía rranza, en la capital del país, Federal participaron como centro de distribución. los cateos."
68572905,['Alan Rodriguez'],PRENSA,2018-01-11T07:07:31Z,2 Hermanitos sin salida,Universal Gráfico,IMPRESO,Nota de Portada,Diario,83384.5,La Roja,"Tue note derrote la cuesta de enero con tu GRÁFICO ENLAMANOganas dinera. ¿HERMANITOS Vecinos intentaron salvar a los niños, pero las llamas arrasaron rápidamente con la humilde vivienda Alan Rodríguez DOS NIÑOS murieron calcinados durante un incendio en una casa de Valle de Chalco, donde sus padres los dejaron encerrados para ir a trabajar. Vecinos de la calle Oriente 44, cerca de la esquina con Norte 4, en la colonia Providencia, intentaron sofocar las llamas del cuarto donde vivía una familia de escasos recursos. Sabían que los dos menores se quedaban solos durante gran parte del día, por lo que utilizaron cubetas de agua para combatir las llamas, que en breve arrasaron con el techo de láminas. TUMBARON LA PUERTA. Conforme las llamas tomaban fuerza los vecinos se desesperaron y por la fuerza lograron tumbar la puerta que impedía salir a los pequeños. Entre el humo y los muebles quemándose fueron ha llados los restos de Jesús Javier, de 3 años y Emily Lizeth, de dos. Minutos después llegaron los servicios de emergencia sólo para diagnosticar la muerte de ambos por quemaduras, lo cual llenó de tristeza a los testigos. Maldita sea no pudimos rescatarlos, se lamentó uno de los voluntarios que rompió en llanto al ver salir a los paramédicos de la habitación siniestrada con las camillas vacías. Los familiares de las víctimas fueron notificados y llegaron al domicilio, donde encontraron la calle acordonada y al personal de la Fiscalía mexiquense realizando los primeros peritajes. Aunque no faltó apoyo emocional para los padres estos entraron en crisis nerviosa al saber que no debieron encerrar a los niños. Hasta el momento se desconocen las causas que originaron el incendio, pero un vecino declaró que el origen del fuego ocurrió en la estufa."
68766373,['Redacción'],PRENSA,2018-01-22T03:02:48Z,"Ciclovía en Reforma, sin definirse",Universal Gráfico,IMPRESO,Nota Informativa,Diario,6661.69,Al Día,"Ciclovía en Reforma, sin definirse La Alcaldía de la Bicicleta en la Ciudad de México ( ABCDMX integrada por 30 especialistas en movilidad y medio ambiente, lamentó que el Instituto Nacional de Antropología e Historia ( INAH ) siga sin dar respuesta al gobierno capitalino para autorizar la construcción de una ciclovía segura sobre el camellón de Paseo de la Reforma, de Lieja a Arquímedes. Por este motivo, Areli Carreón, alcaldesa de ABCDMX, llamó al jefe de Gobierno, Miguel Ángel Mancera, a implementar una solución viable que garantice seguridad a este tipo de transporte, como restar un carril de circulación."
68570809,['Correspondencia'],PRENSA,2018-01-11T05:32:17Z,Pregunta del día,Universal Gráfico,IMPRESO,Carta Abierta,Diario,5290.79,Nacional,"O El fuerte repunte de la inflación en 2017 encareció la vida de todos, pero afecto más a 9 millones de familias con ingresos, si acaso, de 3 salarios mínimos. Opina Es el sexenio más difícil de que tengo memoria, en todos los sexenios ha habido inflación, pero no como esta, que está combinada con el desempleo y aumento de la delincuencia. DANIEL álvarez LÓPEZ Opinó en el Facebook de El Gráfico. El caso es que las personas con menos recursos dedican todo lo que ganan a lo básico, y es lo que ha subido durante todo el año el jitomate está en un sube y baja, el transporte aumentó por lo menos en el Edomex, la gasolina durante todo el año va de poquito en poquito pa rriba desde hace mucho rato y no de ahorita como dice Hacienda. HERMINIO MARTÍNEZ Los precios desde hace tiempo están subiendo, quienes compramos el mandado en el tianguis nos damos cuenta semana a semana, desde las verduras y la fruta, y no se diga la carne, continúan subiendo. Al iniciar este año, en las tiendas se ven todos los productos con uno, dos y hasta tres pesos más, todo en general etiquetado a un costo mayor, y quienes ganamos poco, lo resentimos. ELENA GOLLÁS No se hagan, si suben las gasolinas, sube todo; alimentos, refrescos, pan, huevo todo. DAMIÁN MEJÍA"
68509669,['Redacción'],PRENSA,2018-01-08T07:56:53Z,Atracador pide de rodillas que lo suelten,Universal Gráfico,IMPRESO,Nota Informativa,Diario,8062.73,Contra,"nmcmit PIDE DE RODILLAS QUE LO SUELTEN Las cámaras de vigilancia de una tienda en Houston, Texas, captaron un intento de robo a mano armada, en el que el asaltante tuvo que pedir de rodillas que lo liberaran cuando la cajera, junto con clientes, lo encerraron en la tienda, cuando el sujeto se distrajo. YOUTUBE"
68901182,['Redacción'],PRENSA,2018-01-28T07:50:11Z,Sabo dice estar bíen,Universal Gráfico,IMPRESO,Nota Informativa,Diario,6898.72,Wow,"El cantante Sabo Romo agradece al público por estar al pendiente de su salud, tras haberse sentido mal en el concierto que ofreció Caifanes anoche en Culiacán, Sinaloa, de donde fue sacado en camilla, de acuerdo a las redes sociales. Gracias por estar al pendiente. El parte médico diagnosticó lipotimia por una baja de presión derivada por agotamiento y estrés. Les envío un fuerte abrazo y agradezco todo su cariño, nos vemos en el próximo concierto, señaló el bajista."
68594215,['Redacción'],PRENSA,2018-01-12T07:08:32Z,Luis Fonsi lo hace de nuevo,Universal Gráfico,IMPRESO,Nota Informativa,Diario,3339.23,Wow,"El video del más reciente éxito de Luis Fonsi junto con la cantante estadounidense Demi Lovato chame la culpa, superó 500 millones de reproducciones en YouTube, informó su discográfica, Universal Music. Un éxito más después de Despacito*."
68897598,['Redacción'],PRENSA,2018-01-28T03:22:22Z,Amarrado y degollado,Universal Gráfico,IMPRESO,Nota de Portada,Diario,23832.1,Portada,"VERDUGOS DEJAN NARCOMENSAJE Alan Rodríguez manzana 10, lote 12, en la colonia Galaxias. CON UN narcomensa- La víctima fue identificada de y un cuchillo en el como Eduardo López Larios, pecho fue encontra- quien estaba atado con un lado un cadáver amarrado en zo, en el cuello tenía una heriel interior de un domicilio del da de arma blanca y un cuchimunicipio de San Vicente lio sobre su pecho. Chicoloapan, en el estado de Vecinos se enteraron de México. lo ocurrido una vez que la Los hechos se reportaron calle se llenó de patrullas ayer cerca de las cuatro de la de la policía estataly munitarde en la calle Sagitario, cipal, cuyos agentes res Alan Rodríguez manzana 10, lote 12, en la colonia Galaxias. CON UN narcomensa- La víctima fue identificada de y un cuchillo en el como Eduardo López Larios, pecho fue encontra- quien estaba atado con un lado un cadáver amarrado en zo, en el cuello tenía una heriel interior de un domicilio del da de arma blanca y un cuchimunicipio de San Vicente lio sobre su pecho. Chicoloapan, en el estado de Vecinos se enteraron de México. lo ocurrido una vez que la Los hechos se reportaron calle se llenó de patrullas ayer cerca de las cuatro de la de la policía estataly munitarde en la calle Sagitario, cipal, cuyos agentes res gos dejaron un mensaje, donde se podía leer: Esto me pasó por chapurin para que se alinie atte E.F.M la F.M ( sic ). Hasta el momento no se tiene reporte de personas detenidas por este homicidio, por lo que agentes de la Policía Ministerial se encargan de buscar a los responsables y esclarecer los hechos. Cerca de dos horas después personal de la Fiscalía de Homicidios del estado de México realizó la diliguardaron el lugar de los gencia para retirar el cuerhechos. Junto al cadáver po y trasladarlo al anfiteade López Larios sus verdu- tro local. gos dejaron un mensaje, donde se podía leer: Esto me pasó por chapurin para que se alinie atte E.F.M la F.M ( sic ). Hasta el momento no se tiene reporte de personas detenidas por este homicidio, por lo que agentes de la Policía Ministerial se encargan de buscar a los responsables y esclarecer los hechos. Cerca de dos horas después personal de la Fiscalía de Homicidios del estado de México realizó la diliguardaron el lugar de los gencia para retirar el cuerhechos. Junto al cadáver po y trasladarlo al anfiteade López Larios sus verdu- tro local. do de México realizó la diliguardaron el lugar de los gencia para retirar el cuerhechos. Junto al cadáver po y trasladarlo al anfiteade López Larios sus verdu- tro local. gos dejaron un mensaje, donde se podía leer: Esto me pasó por chapurin para que se alinie atte E.F.M la F.M ( sic ). Hasta el momento no se tiene reporte de personas detenidas por este homicidio, por lo que agentes de la Policía Ministerial se encargan de buscar a los responsables y esclarecer los hechos. Cerca de dos horas después personal de la Fiscalía de Homicidios del estado de México realizó la diliguardaron el lugar de los gencia para retirar el cuerhechos. Junto al cadáver po y trasladarlo al anfiteade López Larios sus verdu- tro local."
68800918,['Redacción'],PRENSA,2018-01-23T13:56:33Z,Uribe se queda con su expulsión,Universal Gráfico,IMPRESO,Nota Informativa,Diario,10636.2,Nacional,"Se perderá duelo ante Atlas, ya que la apelación del América no procedió EL mediocampista colombiano del América, Matheus Uribe, se perderá el juego ante Atlas de la fecha cuatro del Clausura 2018 luego de que no procedió la apelación presentada por el club ante la Comisión Disciplinaria de la Federación Mexicana de Fútbol. La escuadra que dirige Miguel Herrera consideró manifiestamente errónea la tarjeta roja que recibió su jugador en el pasado clásico contra Pumas, por lo que presentó una solicitud de inconformidad. Tras analizar la jugada correspondiente ( una chilena de Uribe en la que pega a Nicolás Castillo ) así como valorado las pruebas, se hace del conocimiento que no procede la solicitud, informó la Disciplinaria. CONVIVENCIA CON FANS. A través de sus redes sociales, el cuadro azulcrema invitó a todos sus seguidores para que asistan este viernes 26 de enero al entrenamiento a puertas abiertas que se llevará a cabo en el Estadio Azteca. La cita es a las 10 de la mañana en el Coloso de Santa Úrsula, donde además dé la práctica se realizará la fotografía oficial del equipo. El acceso es gratis. La institución emplumada también regalará boletos para el duelo entre América y Cruz Azulde la Ligafemenila los primeros 2 mil aficionados que se presenten en el Azteca. Redacción y agencias"
68917562,['Redacción'],PRENSA,2018-01-29T06:57:34Z,¡Humilladas!,Universal Gráfico,IMPRESO,Nota Informativa,Diario,18626.1,Deportes,"LAS ÁGUILAS del América fueron contundentes en casa y golearon 7-1 a las cementeras de Cruz Azul, en partido de la jornada cuatro de la Liga Femenil. Este resultado deja a las zulcremas en el primer puesto del Grupo 1, mientras que las celestessequedaronenelquinto, con cuatro unidades. DE VOLADA América abrió el marcador al minuto tres, cuando la defensa visitante rechazó mal, el balón pegó en el larguero y quedó de frente para Lucero Cuevas, quien sólo empujó alfondo de las redes el 1-0. La Máquina empató al 32. Sharon Barba controló en la media luna, se dio vuelta y en zona de peligro le pegó con rumbo al rincón izquierdo. El festejo le duró poco a las de La Noria, pues Ana Lozada adelantó nuevamente a las de Coapa al 36, en un tiro de esquina en el que ganó por alto y cabeceó a la cabaña rival. En el complemento siguió la masacre de la escuadra americanista: El 3-1 al 53, cuando Betzy Cuevas recibió un saque de banda, giró para dejar atrás a una defensa, se metió a zona de peligro y definió cruzado. La confianza creció en elequipo azulcrema, por lo que Lucero Cuevas aprovechó para anotar su segundo de la noche al 67. La delantera bajó de pecho un rebote y fusiló sin problema al sector derecho del marco para el 4-1 a favor de las anfitrionas. FIESTA. El marcador sumó más festejos. El siguiente tanto llegó al minuto 74 por medio de Betzy Cuevas, quien también se hizo presente por segunda ocasión en el Coloso de Santa Úrsula y de manera espectacular: Ganó el balón en el corazón del área y remató suave y colocado a primer palo. Cuando las Águilas del América todavía festejaban el quinto, Diana Fierro sorprendió al 75, tras burlar a una defensora con una vistosa bicicleta y definir mano a mano contra la guardameta celeste. Llegaba la recta final, pero América no renunció. Corría el 79, Edna Santamaría se metió al área contraria y con un cabezazo puso el marcador 7-1 para las Águilas. Redacción"
68935839,['Martí Batres Guadarrama'],PRENSA,2018-01-30T02:42:01Z,Objeciones de la Memoria // Desvío electoral en Iztapalapa,Universal Gráfico,IMPRESO,Columna Política,Diario,15375.9,Voces,"MARTÍ BATRES GUADARRAMA A LOS ACTOS DE VIOLENCIA política en el contexto de las precampañas electorales se suma la compra del voto. En 2016, fue por todos conocido que mediante de un esquema denominado Empleo Temporal el partido del gobierno en la capital utilizó recursos públicos para obtener beneficios electorales en el contexto de la campaña para la elección de la Asamblea Constituyente. El pasado lunes 22, dirigentes de Morena y representantes de ese partido ante los órganos electorales se reunieron con los consejeros del Instituto Electoral de la Ciudad de México. En el encuentro, las autoridades fueron alertadas del riesgo de que una vez más los gobiernos perredistas recurrieran al desvío de recursos públicos para beneficiarse electoralmente. No obstante, la mañana siguiente nos desayunamos con la noticia de que en la Gaceta Oficial de la Ciudad de México se publicaron los lineamientos operativos de dos programas disfrazados de acciones institucionales, mediante las que la delegación Iztapalapa pretende desviar 108 millones de pesos del erario para financiar a sus operadores electorales. De acuerdo a lo publicado en la Gaceta, la delegación Iztapalapa, a partir de la acción denominada Poder Ciudadano pretende entregar 12 apoyos económicos de 6 mil pesos para mil tres personas que se desempeñen como monitores delegacionales. Por su parte, mediante La acción Poder Vincularse, la delegación Iztapalapa quiere aplicar el esquema anterior a mil tres personas, pero con un salario de 3 mil pesos mensuales por un año. De forma casual, el territorio de la delegación Iztapalapa está dividido por mil tres secciones electorales. Resulta obvio que, el objetivo de estos programas, tienen el objetivo de financiar con recursos públicos la operación elec toral del PRD en Iztapalapa. Esta operación costará más de 108 millones de pesos, mientras que el financiamiento público electoral del PRD para toda la ciudad consta de 38 millones de pesos. Esto quiere decir, que de forma ilegal en Iztapalapa se busca aplicar a la operación electoral recursos públicos que triplican el total del presupuesto de su partido en toda la entidad. Se trata de una acción ilegal, indignante no sólo por los efectos electorales. Iztapalapa es una de las delegaciones más pobres de la Ciudad y fue una de las que sufrió más afectaciones por el pasado sismo de setiembre. Irónicamente, la partida de donde piensan sacar estos recursos se llama ayudas sociales a personas u hogares de escasos recursos. ¿Cuántas personas u hogares de escasos recursos resultaron dañados en Iztapalapa por el sismo? ¿Cuántas personas damnificadas han recibido apoyos similares a los que la delegación Iztapalapa piensa entregar a sus operadores electorales? Las autoridades electorales están obligadas a actuar y frenar este desvío que, en caso de concretarse, sería escandaloso y demostraría el nivel de deterioro político y ético en el que ha caído el PRD. De forma ilegal, en Iztapalapa se busca aplicar a la operación electoral recursos públicos que triplican el total del presupuesto de su partido en toda la entidad Iróúnicamente, la partida de donde piensan sacar estos recursos se llama ayudas sociales a personas u hogares de escasos recursos."
